Nombre,Categoria1,Categoria2,UM,Precio Unitario,Precio,categoria_principal,Marca
Filete de bacalao Selección de Dia bandeja 350 g aprox.,"Pescados, mariscos y ahumados",Pescados,KILO,14.99,5.25,Marisco y pescado,Selección de Dia
Queso fundido con palitos de pan La vaca que ríe caja 140 g,Charcutería y quesos,Quesos fundidos y cremas,KILO,17.07,2.39,Charcutería y quesos,otra
Fiambre de lomo de pavo Serrano bandeja 240 g,Carnicería,Pavo,KILO,10.38,2.49,Carne,otra
Pechuga de pavo adobada Serrano bandeja 240 g,Carnicería,Pavo,KILO,10.79,2.59,Carne,otra
Medio conejo troceado Selección de Dia bandeja 650 g aprox.,Carnicería,Conejo,KILO,8.99,5.84,Carne,Selección de Dia
Queso fundido sándwich Dia Láctea bolsa 300 g,Charcutería y quesos,Quesos fundidos y cremas,KILO,3.97,1.19,Charcutería y quesos,Dia Láctea
Paté de hígado de cerdo Mina lata 3 x 80 g,Charcutería y quesos,"Foie, paté y sobrasada",KILO,9.13,2.19,Charcutería y quesos,otra
Mini queso tierno snack Babybel malla 120 g,Charcutería y quesos,Quesos fundidos y cremas,KILO,22.83,2.74,Charcutería y quesos,otra
Paté de campaña Nuestra Alacena de Dia frasco 125 g,Charcutería y quesos,"Foie, paté y sobrasada",KILO,8.72,1.09,Charcutería y quesos,Nuestra Alacena
Paté de cerdo ibérico Nuestra Alacena de Dia frasco 125 g,Charcutería y quesos,"Foie, paté y sobrasada",KILO,8.72,1.09,Charcutería y quesos,Nuestra Alacena
Pizza 4 quesos Al Punto Dia bandeja 390 g,Pizzas y platos preparados,Pizzas,KILO,6.9,2.69,Pizzas y platos preparados,Dia
Pizza carbonara Casa Tarradellas bandeja 400 g,Pizzas y platos preparados,Pizzas,KILO,7.98,3.19,Pizzas y platos preparados,otra
Queso de untar con finas hierbas Philadelphia tarrina 150 g,Charcutería y quesos,Quesos fundidos y cremas,KILO,15.93,2.39,Charcutería y quesos,otra
Queso gouda Selección Mundial de Dia bandeja 400 g,Charcutería y quesos,Quesos internacionales,KILO,7.33,2.93,Charcutería y quesos,Selección Mundial
Queso de untar light Philadelphia tarrina 250 g,Charcutería y quesos,Quesos fundidos y cremas,KILO,10.72,2.68,Charcutería y quesos,otra
Queso de untar original Philadelphia tarrina 250 g,Charcutería y quesos,Quesos fundidos y cremas,KILO,10.72,2.68,Charcutería y quesos,otra
Pizza jamón y queso Casa Tarradellas bandeja 2 x 225 g,Pizzas y platos preparados,Pizzas,KILO,7.09,3.19,Pizzas y platos preparados,otra
Paté a las finas hierbas Nuestra Alacena de Dia frasco 125 g,Charcutería y quesos,"Foie, paté y sobrasada",KILO,8.72,1.09,Charcutería y quesos,Nuestra Alacena
Paté a la pimienta Nuestra Alacena de Dia frasco 125 g,Charcutería y quesos,"Foie, paté y sobrasada",KILO,8.72,1.09,Charcutería y quesos,Nuestra Alacena
Pizza 4 quesos Casa Tarradellas bandeja 390 g,Pizzas y platos preparados,Pizzas,KILO,8.18,3.19,Pizzas y platos preparados,otra
Chistorra de navarra Selección de Dia bolsa 220 g,Carnicería,Cerdo,KILO,7.68,1.69,Carne,Selección de Dia
Pizza atún y bacon Al Punto Dia bandeja 400 g,Pizzas y platos preparados,Pizzas,KILO,6.73,2.69,Pizzas y platos preparados,Dia
Pizza jamón y queso Al Punto Dia bandeja 400 g,Pizzas y platos preparados,Pizzas,KILO,6.03,2.41,Pizzas y platos preparados,Dia
Panceta adobada de cerdo Selección de Dia bandeja 350 g aprox.,Carnicería,Cerdo,KILO,8.99,3.15,Carne,Selección de Dia
Secreto adobado de cerdo Selección de Dia bandeja 300 g aprox. ,Carnicería,Cerdo,KILO,9.69,2.91,Carne,Selección de Dia
Filete de vacuno marinado empanado Selección de Dia bandeja 500 g aprox.,Carnicería,Vacuno,KILO,14.99,7.5,Carne,Selección de Dia
Buñuelos de bacalao Freskibo bandeja 225 g,"Pescados, mariscos y ahumados",Pescados,KILO,13.29,2.99,Marisco y pescado,otra
Mousse de queso con nueces President Bon délice tarrina 125 g,Charcutería y quesos,Quesos fundidos y cremas,KILO,15.92,1.99,Charcutería y quesos,otra
Pizza smoky grilled pork Al Punto Dia bandeja 480 g,Pizzas y platos preparados,Pizzas,KILO,6.23,2.99,Pizzas y platos preparados,Dia
Sepia Selección de Dia bandeja 320 g aprox.,"Pescados, mariscos y ahumados",Pescados,KILO,15.6,4.99,Marisco y pescado,Selección de Dia
Pimiento rojo unidad 390 g aprox.,Verduras,"Tomates, pimientos y pepinos",KILO,2.99,1.17,Fruta y verdura,otra
Albóndigas Al Punto Dia lata 415 g,Pizzas y platos preparados,Precocinados envasados,KILO,4.05,1.68,Pizzas y platos preparados,Dia
Palitos de surimi refrigeradas MSC Mari Marinera de Dia bolsa 300 g,"Pescados, mariscos y ahumados",Gulas y surimi,KILO,6.3,1.89,Marisco y pescado,Dia
Fabada asturiana Litoral lata 420 g,Pizzas y platos preparados,Precocinados envasados,KILO,5.95,2.5,Pizzas y platos preparados,otra
Cebolla morada malla 500 g,Verduras,"Ajos, cebollas y puerros",KILO,2.98,1.49,Fruta y verdura,otra
Patatas granel 1 Kg aprox.,Verduras,Patatas y zanahorias,KILO,1.99,1.99,Fruta y verdura,otra
Fabada asturiana Litoral lata 850 g,Pizzas y platos preparados,Precocinados envasados,KILO,5.4,4.59,Pizzas y platos preparados,otra
Repollo liso unidad aprox. 2 Kg aprox.,Verduras,"Judías, brócolis y coliflores",KILO,1.39,2.78,Fruta y verdura,otra
Sopa juliana deshidratada Trevijano bandeja 100 g,Pizzas y platos preparados,Precocinados envasados,KILO,23.0,2.3,Pizzas y platos preparados,otra
Cocido madrileño Al Punto Dia lata 425 g,Pizzas y platos preparados,Precocinados envasados,KILO,4.16,1.77,Pizzas y platos preparados,Dia
Fabada asturiana Al Punto Dia lata 435 g,Pizzas y platos preparados,Precocinados envasados,KILO,3.45,1.5,Pizzas y platos preparados,Dia
Callos a la madrileña Litoral lata 380 g,Pizzas y platos preparados,Precocinados envasados,KILO,12.87,4.89,Pizzas y platos preparados,otra
Ensaladilla rusa deshidratada Trevijano bandeja 110 g,Pizzas y platos preparados,Precocinados envasados,KILO,19.64,2.16,Pizzas y platos preparados,otra
Tomate pera granel 900 g aprox.,Verduras,"Tomates, pimientos y pepinos",KILO,1.99,1.79,Fruta y verdura,otra
Cebolla dulce granel 1 Kg aprox.,Verduras,"Ajos, cebollas y puerros",KILO,2.49,2.49,Fruta y verdura,otra
Lentejas a la riojana Litoral lata 430 g,Pizzas y platos preparados,Precocinados envasados,KILO,5.09,2.19,Pizzas y platos preparados,otra
Salmón ahumado Selección Mundial de Dia sobre 200 g,"Pescados, mariscos y ahumados","Ahumados, salazones y preparados",KILO,36.0,7.2,Marisco y pescado,Selección Mundial
Palitos de surimi Krissia bolsa 180 g,"Pescados, mariscos y ahumados",Gulas y surimi,KILO,16.61,2.99,Marisco y pescado,otra
Cocido madrileño Litoral lata 425 g,Pizzas y platos preparados,Precocinados envasados,KILO,6.8,2.89,Pizzas y platos preparados,otra
Callos con chorizo Al Punto Dia lata 380 g,Pizzas y platos preparados,Precocinados envasados,KILO,6.05,2.3,Pizzas y platos preparados,Dia
Alitas de pollo barbacoa Earra tarrina 500 g,Pizzas y platos preparados,Precocinados envasados,KILO,7.98,3.99,Pizzas y platos preparados,otra
Cebolla tierna 1 unidad,Verduras,"Ajos, cebollas y puerros",UNIDAD,0.49,0.49,Fruta y verdura,otra
Tomate bárbaro bolsa 900 g aprox.,Verduras,"Tomates, pimientos y pepinos",KILO,2.49,2.24,Fruta y verdura,otra
Bocados vegetales estilo Mediterráneo Revolu green bandeja 160 g,Pizzas y platos preparados,Precocinados envasados,KILO,23.69,3.79,Pizzas y platos preparados,otra
Bocadillo de bacon y queso Al Punto Dia caja 200 g,Pizzas y platos preparados,Precocinados envasados,KILO,12.95,2.59,Pizzas y platos preparados,Dia
Bocadillo de pollo y queso Al Punto Dia caja 200 g,Pizzas y platos preparados,Precocinados envasados,KILO,12.95,2.59,Pizzas y platos preparados,Dia
Boquerones al vinagre con ajo y perejil MSC Mari Marinera de Dia bandeja 80 g,"Pescados, mariscos y ahumados","Ahumados, salazones y preparados",KILO,31.13,2.49,Marisco y pescado,Dia
Salmón ahumado marinado Nuchar sobre 80 g,"Pescados, mariscos y ahumados","Ahumados, salazones y preparados",KILO,49.88,3.99,Marisco y pescado,otra
Aceituna gordal rellena de boquerón del Cantábrico MSC Kiele bandeja 150 g,"Pescados, mariscos y ahumados","Ahumados, salazones y preparados",KILO,19.93,2.99,Marisco y pescado,otra
Patata malla 4 Kg,Verduras,Patatas y zanahorias,KILO,1.5,5.99,Fruta y verdura,otra
Manzana golden granel 500 g aprox.,Frutas,Manzanas,KILO,2.19,1.1,Fruta y verdura,otra
Pasta oriental sabor curry Maggi sobre 71 g,Pizzas y platos preparados,Comida internacional,KILO,12.68,0.9,Pizzas y platos preparados,otra
Tortillas de trigo Old El Paso bolsa 244 g,Pizzas y platos preparados,Comida internacional,KILO,9.63,2.35,Pizzas y platos preparados,otra
Manzana roja selección granel 500 g aprox.,Frutas,Manzanas,KILO,2.69,1.35,Fruta y verdura,otra
Pera conferencia bandeja 1 Kg,Frutas,Peras,KILO,2.19,2.19,Fruta y verdura,otra
Manzana fuji bolsa 1 Kg,Frutas,Manzanas,KILO,2.29,2.29,Fruta y verdura,otra
Plátano macho para freír granel 1 Kg aprox.,Frutas,Platanos,KILO,2.89,2.89,Fruta y verdura,otra
Mango 1 unidad,Frutas,Frutas tropicales,KILO,3.86,1.99,Fruta y verdura,otra
Lombarda bolsa 2 Kg aprox.,Verduras,Otras verduras,KILO,1.49,2.98,Fruta y verdura,otra
Manzana granny granel 800 g aprox.,Frutas,Manzanas,KILO,2.19,1.75,Fruta y verdura,otra
Repollo rizado unidad aprox. 1 Kg,Verduras,Otras verduras,KILO,1.49,1.49,Fruta y verdura,otra
Banana granel 900 g aprox.,Frutas,Platanos,KILO,1.49,1.34,Fruta y verdura,otra
Aguacate granel 1 Kg aprox.,Frutas,Frutas tropicales,KILO,4.59,4.59,Fruta y verdura,otra
Pimientos asados a la leña bandeja 350 g,Verduras,Verduras y ensaladas preparadas,KILO,7.69,2.69,Fruta y verdura,otra
Kiwi Sungold Zespri bandeja 535 g,Frutas,Frutas tropicales,KILO,5.21,2.79,Fruta y verdura,otra
Limón bio malla 500 g,Frutas,Limones y pomelos,KILO,1.98,0.99,Fruta y verdura,otra
Pera Rincón de Soto D.O.P. granel 500 g aprox.,Frutas,Peras,KILO,2.79,1.4,Fruta y verdura,otra
Limón selección 1 unidad,Frutas,Limones y pomelos,KILO,1.16,0.29,Fruta y verdura,otra
Salsa chunky Zanuy frasco 300 g,Pizzas y platos preparados,Comida internacional,KILO,7.33,2.2,Pizzas y platos preparados,otra
Pollo al curry con arroz basmati Al Punto Dia bandeja 300 g,Pizzas y platos preparados,Comida internacional,KILO,9.83,2.95,Pizzas y platos preparados,Dia
Rollitos de primavera Al Punto Dia bandeja 280 g,Pizzas y platos preparados,Comida internacional,KILO,8.75,2.45,Pizzas y platos preparados,Dia
Fideos yakisoba  Al Punto Dia bandeja 250 g,Pizzas y platos preparados,Comida internacional,KILO,9.8,2.45,Pizzas y platos preparados,Dia
Fajitas Al Punto Dia bandeja 275 g,Pizzas y platos preparados,Precocinados envasados,KILO,7.09,1.95,Pizzas y platos preparados,Dia
Ensalada wrap texas Al Punto Dia bandeja 300 g,Verduras,Verduras y ensaladas preparadas,KILO,9.97,2.99,Fruta y verdura,Dia
Salsa en polvo Tajín frasco 142 g,Pizzas y platos preparados,Comida internacional,KILO,23.24,3.3,Pizzas y platos preparados,otra
Pulpa aguacate Al Punto Dia tarrina 125 g,Frutas,Frutas tropicales,KILO,11.6,1.45,Fruta y verdura,Dia
Guacamole Al Punto Dia tarrina 400 g,Frutas,Frutas tropicales,KILO,7.38,2.95,Fruta y verdura,Dia
Guacamole Al Punto Dia tarrina 200 g,Frutas,Frutas tropicales,KILO,8.45,1.69,Fruta y verdura,Dia
Tortillas integrales bolsa Old El Paso bolsa 350 g,Pizzas y platos preparados,Comida internacional,KILO,9.69,3.39,Pizzas y platos preparados,otra
Fideos orientales fusian sabor teriyaki Maggi sobre 130 g,Pizzas y platos preparados,Comida internacional,KILO,15.31,1.99,Pizzas y platos preparados,otra
Vinagre de manzana Aliña tu Dia botella 1 l,"Aceites, salsas y especias",Vinagres y aliños,LITRO,0.85,0.85,"Aceite, especias y salsas",Dia
Tallarines Gallo bolsa 450 g,"Arroz, pastas y legumbres",Pastas,KILO,2.96,1.33,"Arroz, legumbres y pastas",otra
Tallarines Al Diante Dia bolsa 500 g,"Arroz, pastas y legumbres",Pastas,KILO,1.64,0.82,"Arroz, legumbres y pastas",Dia
Aceite de oliva virgen extra Carbonell botella 1 l,"Aceites, salsas y especias",Aceites,LITRO,15.89,15.89,"Aceite, especias y salsas",otra
Espaguetis nº 3 Gallo bolsa 450 g,"Arroz, pastas y legumbres",Pastas,KILO,2.96,1.33,"Arroz, legumbres y pastas",otra
Fideo nº 0 Gallo bolsa 450 g,"Arroz, pastas y legumbres",Pastas,KILO,2.96,1.33,"Arroz, legumbres y pastas",otra
Pluma nº 6 Gallo bolsa 450 g,"Arroz, pastas y legumbres",Pastas,KILO,2.96,1.33,"Arroz, legumbres y pastas",otra
Vinagre balsámico de módena Borges botella 250 ml,"Aceites, salsas y especias",Vinagres y aliños,LITRO,8.76,2.19,"Aceite, especias y salsas",otra
Fideuá Al Diante Dia bolsa 500 g,"Arroz, pastas y legumbres",Pastas,KILO,1.64,0.82,"Arroz, legumbres y pastas",Dia
Arroz integral Arrozona de Dia paquete 1 Kg,"Arroz, pastas y legumbres",Arroz,KILO,1.7,1.7,"Arroz, legumbres y pastas",Dia
Arroz basmati Brillante vaso 2 x 125 g,"Arroz, pastas y legumbres",Arroz,KILO,5.36,1.34,"Arroz, legumbres y pastas",otra
Arroz largo de primera categoría Arrozona de Dia bolsa 1 Kg,"Arroz, pastas y legumbres",Arroz,KILO,1.35,1.35,"Arroz, legumbres y pastas",Dia
Aceite de oliva virgen extra Hojiblanca botella 1 l,"Aceites, salsas y especias",Aceites,LITRO,15.89,15.89,"Aceite, especias y salsas",otra
Aceite de oliva virgen extra Hojiblanca botella 500 ml,"Aceites, salsas y especias",Aceites,LITRO,15.9,7.95,"Aceite, especias y salsas",otra
Arroz basmati Selección Mundial de Dia paquete 1 Kg,"Arroz, pastas y legumbres",Arroz,KILO,2.44,2.44,"Arroz, legumbres y pastas",Selección Mundial
Espagueti Al Diante Dia bolsa 1 Kg,"Arroz, pastas y legumbres",Pastas,KILO,1.3,1.3,"Arroz, legumbres y pastas",Dia
Espagueti Al Diante Dia bolsa 500 g,"Arroz, pastas y legumbres",Pastas,KILO,1.64,0.82,"Arroz, legumbres y pastas",Dia
Sopa maravilla Al Diante Dia bolsa 500 g,"Arroz, pastas y legumbres",Pastas,KILO,1.64,0.82,"Arroz, legumbres y pastas",Dia
Sal marina gruesa Dia paquete 1 Kg,"Aceites, salsas y especias",Sal y especias,KILO,0.35,0.35,"Aceite, especias y salsas",Dia
Macarrón Al Diante Dia bolsa 500 g,"Arroz, pastas y legumbres",Pastas,KILO,1.64,0.82,"Arroz, legumbres y pastas",Dia
Fideo cabellín Al Diante Dia bolsa 500 g,"Arroz, pastas y legumbres",Pastas,KILO,1.64,0.82,"Arroz, legumbres y pastas",Dia
Macarrón Al Diante Dia bolsa 1 Kg,"Arroz, pastas y legumbres",Pastas,KILO,1.3,1.3,"Arroz, legumbres y pastas",Dia
Fideo entrefino Al Diante Dia bolsa 500 g,"Arroz, pastas y legumbres",Pastas,KILO,1.64,0.82,"Arroz, legumbres y pastas",Dia
Aceite refinado de girasol Diasol garrafa 5 l,"Aceites, salsas y especias",Aceites,LITRO,1.4,6.99,"Aceite, especias y salsas",Dia
Aceite de oliva suave La masía botella 1 l,"Aceites, salsas y especias",Aceites,LITRO,10.49,10.49,"Aceite, especias y salsas",otra
Arroz integral SOS bolsa 1 Kg,"Arroz, pastas y legumbres",Arroz,KILO,2.05,2.05,"Arroz, legumbres y pastas",otra
Cereza bandeja 500 g,Frutas,Frutas de temporada,KILO,7.98,3.99,Fruta y verdura,otra
Melocotón rojo granel 750 g aprox.,Frutas,Frutas de temporada,KILO,4.49,3.37,Fruta y verdura,otra
Café en cápsulas espresso intenso Nescafé Dolce Gusto caja 16 unidades,"Café, cacao e infusiones",Café,UNIDAD,0.27,4.25,"Cacao, café e infusiones",Nescafé
Infusión duerme bien Pompadour caja 20 unidades,"Café, cacao e infusiones",Té e infusiones,UNIDAD,0.14,2.79,"Cacao, café e infusiones",otra
Salsa de soja Heinz frasco 150 ml,"Aceites, salsas y especias","Mayonesa, ketchup y otras salsas",LITRO,19.93,2.99,"Aceite, especias y salsas",otra
Batido de chocolate Puleva brik 6 x 200 ml,"Leche, huevos y mantequilla",Batidos y horchatas,LITRO,2.29,2.75,"Huevos , leche y mantequilla",otra
Salsa para hamburguesas Salseo de Dia bote 300 g,"Aceites, salsas y especias","Mayonesa, ketchup y otras salsas",KILO,5.63,1.69,"Aceite, especias y salsas",Dia
Salsa barbacoa Salseo de Dia bote 360 g,"Aceites, salsas y especias","Mayonesa, ketchup y otras salsas",KILO,3.03,1.09,"Aceite, especias y salsas",Dia
Ketchup light Salseo de Dia bote 540 g,"Aceites, salsas y especias","Mayonesa, ketchup y otras salsas",KILO,2.69,1.45,"Aceite, especias y salsas",Dia
Leche desnatada Central Lechera Asturiana botella 6 x 1.5 l,"Leche, huevos y mantequilla",Leche,LITRO,1.06,9.54,"Huevos , leche y mantequilla",Central Lechera Asturiana
Leche desnatada Central Lechera Asturiana botella 1.5 l,"Leche, huevos y mantequilla",Leche,LITRO,1.06,1.59,"Huevos , leche y mantequilla",Central Lechera Asturiana
Leche entera Central Lechera Asturiana botella 6 x 1.5 l,"Leche, huevos y mantequilla",Leche,LITRO,1.13,10.14,"Huevos , leche y mantequilla",Central Lechera Asturiana
Leche entera Central Lechera Asturiana botella 1.5 l,"Leche, huevos y mantequilla",Leche,LITRO,1.13,1.69,"Huevos , leche y mantequilla",Central Lechera Asturiana
Bebida de soja Pascual Vivesoy brik 1 l,"Leche, huevos y mantequilla",Bebidas vegetales,LITRO,1.89,1.89,"Huevos , leche y mantequilla",otra
Leche desnatada Pascual brik 6 x 1 l,"Leche, huevos y mantequilla",Leche,LITRO,1.3,7.8,"Huevos , leche y mantequilla",otra
Leche desnatada Pascual brik 1 l,"Leche, huevos y mantequilla",Leche,LITRO,1.3,1.3,"Huevos , leche y mantequilla",otra
Leche semidesnatada Pascual brik 6 x 1 l,"Leche, huevos y mantequilla",Leche,LITRO,1.3,7.8,"Huevos , leche y mantequilla",otra
Leche semidesnatada Pascual brik 1 l,"Leche, huevos y mantequilla",Leche,LITRO,1.3,1.3,"Huevos , leche y mantequilla",otra
Leche entera Pascual brik 6 x 1 l,"Leche, huevos y mantequilla",Leche,LITRO,1.3,7.8,"Huevos , leche y mantequilla",otra
Leche entera Pascual brik 1 l,"Leche, huevos y mantequilla",Leche,LITRO,1.3,1.3,"Huevos , leche y mantequilla",otra
Nata para cocinar Puleva brik 200 ml,"Leche, huevos y mantequilla",Nata,LITRO,8.3,1.66,"Huevos , leche y mantequilla",otra
Café molido mezcla intensa La estrella bolsa 250 g,"Café, cacao e infusiones",Café,KILO,9.8,2.45,"Cacao, café e infusiones",otra
Mayonesa Ybarra frasco 400 ml,"Aceites, salsas y especias","Mayonesa, ketchup y otras salsas",LITRO,5.48,2.19,"Aceite, especias y salsas",otra
Margarina Proactiv tarrina 225 g,"Leche, huevos y mantequilla",Mantequilla y margarina,KILO,13.11,2.95,"Huevos , leche y mantequilla",otra
Cacao soluble ColaCao bote 383 g,"Café, cacao e infusiones",Cacao,KILO,9.9,3.79,"Cacao, café e infusiones",otra
Nata en spray Dia Láctea bote 250 g,"Leche, huevos y mantequilla",Nata,KILO,6.76,1.69,"Huevos , leche y mantequilla",Dia Láctea
Bebida láctea crecimiento y desarrollo Puleva brik 1 l,"Leche, huevos y mantequilla",Leche,LITRO,1.89,1.89,"Huevos , leche y mantequilla",otra
Cacao instantáneo Nesquik estuche 2 Kg,"Café, cacao e infusiones",Cacao,KILO,5.0,9.99,"Cacao, café e infusiones",Nesquik
Leche en polvo Sveltesse lata 600 g,"Leche, huevos y mantequilla",Leche,KILO,14.0,8.4,"Huevos , leche y mantequilla",otra
Leche condensada La lechera lata 740 g,"Leche, huevos y mantequilla",Leche,KILO,5.39,3.99,"Huevos , leche y mantequilla",otra
Bebida láctea folic b Flora brik 1 l,"Leche, huevos y mantequilla",Leche,LITRO,1.83,1.83,"Huevos , leche y mantequilla",otra
Leche condensada La lechera lata 370 g,"Leche, huevos y mantequilla",Leche,KILO,7.27,2.69,"Huevos , leche y mantequilla",otra
Chocolate con leche relleno con caramelo y avellanas Milka 300 g,"Azúcar, chocolates y caramelos",Chocolates y bombones,KILO,12.97,3.89,"Azúcar, caramelos y chocolate",otra
Barritas de barquillo recubierta de chocolate con leche Huesitos bolsa 200 g,"Azúcar, chocolates y caramelos",Chocolates y bombones,KILO,12.25,2.45,"Azúcar, caramelos y chocolate",otra
Palitos de pan y crema de cacao Bollycao vaso 52 g,"Galletas, bollos y cereales",Bollería,KILO,38.27,1.99,Cereales y galletas,otra
Conchas de chocolate Codan bolsa 330 g,"Galletas, bollos y cereales",Bollería,KILO,6.94,2.29,Cereales y galletas,otra
Galletas digestive con avena y chocolate Gullón caja 425 g,"Galletas, bollos y cereales",Galletas,KILO,5.15,2.19,Cereales y galletas,otra
Rosquillas de chocolate El molino de Dia bandeja 240 g,"Galletas, bollos y cereales",Bollería,KILO,7.46,1.79,Cereales y galletas,Dia
Golosinas surtidas little mix Fini tarrina 500 g,"Azúcar, chocolates y caramelos","Caramelos, chicles y golosinas",KILO,7.58,3.79,"Azúcar, caramelos y chocolate",otra
Barritas de cereales con chocolate nesquik Nestlé caja 150 g,"Galletas, bollos y cereales",Cereales,KILO,19.93,2.99,Cereales y galletas,otra
Cereales integrales con chocolate negro Nestlé Fitness caja 375 g,"Galletas, bollos y cereales",Cereales,KILO,9.31,3.49,Cereales y galletas,otra
Ensaimadas El molino de Dia bolsa 220 g,"Galletas, bollos y cereales",Bollería,KILO,5.41,1.19,Cereales y galletas,Dia
Galletas digestive con chocolate con leche Fontaneda caja 300 g,"Galletas, bollos y cereales",Galletas,KILO,12.33,3.7,Cereales y galletas,otra
Magdalenas rellenas con crema de cacao El molino de Dia bolsa 336 g,"Galletas, bollos y cereales",Bollería,KILO,5.03,1.69,Cereales y galletas,Dia
Bombones rellenos de coco y almendra Ferrero Raffaello caja 150 g,"Azúcar, chocolates y caramelos",Chocolates y bombones,KILO,26.33,3.95,"Azúcar, caramelos y chocolate",otra
Bombones cortados clásicos Trapa caja 115 g,"Azúcar, chocolates y caramelos",Chocolates y bombones,KILO,20.43,2.35,"Azúcar, caramelos y chocolate",otra
Barritas de cereales con chocolate con leche Corny caja 150 g,"Galletas, bollos y cereales",Cereales,KILO,16.6,2.49,Cereales y galletas,otra
Roscos de galleta con chocolate con leche chocoaros Galleteca de Dia bolsa 128 g,"Galletas, bollos y cereales",Galletas,KILO,6.17,0.79,Cereales y galletas,Galleteca
Galletas digestive Galleteca de Dia caja 800 g,"Galletas, bollos y cereales",Galletas,KILO,2.19,1.75,Cereales y galletas,Galleteca
Gazpacho Al Punto Dia brik 3 x 330 ml,Pizzas y platos preparados,Gazpachos y salmorejos,LITRO,1.97,1.95,Pizzas y platos preparados,Dia
Chocolate con leche y almendras Temptation de Dia 150 g,"Azúcar, chocolates y caramelos",Chocolates y bombones,KILO,7.67,1.15,"Azúcar, caramelos y chocolate",Dia
Chocolate con leche y avellanas Temptation de Dia 150 g,"Azúcar, chocolates y caramelos",Chocolates y bombones,KILO,7.67,1.15,"Azúcar, caramelos y chocolate",Dia
Chocolate blanco Temptation de Dia 2 x 200 g,"Azúcar, chocolates y caramelos",Chocolates y bombones,KILO,7.5,1.5,"Azúcar, caramelos y chocolate",Dia
Chocolate con leche Temptation de Dia 2 x 150 g,"Azúcar, chocolates y caramelos",Chocolates y bombones,KILO,6.63,1.99,"Azúcar, caramelos y chocolate",Dia
Palmeritas El molino de Dia bandeja 245 g,"Galletas, bollos y cereales",Bollería,KILO,4.98,1.22,Cereales y galletas,Dia
Galletas digestive sin azúcares Gullón caja 400 g,"Galletas, bollos y cereales",Galletas,KILO,6.63,2.65,Cereales y galletas,otra
Huevo de chocolate con sorpresa joy Kinder 20 g,"Azúcar, chocolates y caramelos",Chocolates y bombones,KILO,70.0,1.4,"Azúcar, caramelos y chocolate",Kinder
Azúcar blanco Dia paquete 1 Kg,"Azúcar, chocolates y caramelos",Azúcar y edulcorantes,KILO,1.45,1.45,"Azúcar, caramelos y chocolate",Dia
Caramelos con palo varios sabores Chupa Chups bolsa 208 g,"Azúcar, chocolates y caramelos","Caramelos, chicles y golosinas",KILO,15.38,3.2,"Azúcar, caramelos y chocolate",Chupa Chups
Mermelada de fresa extra Helios frasco 340 g,"Azúcar, chocolates y caramelos",Mermeladas y frutas en almibar,KILO,5.88,2.0,"Azúcar, caramelos y chocolate",otra
Pan de molde formato familiar El molino de Dia bolsa 820 g,"Panes, harinas y masas","Pan de molde, perritos y hamburguesas.",KILO,1.52,1.25,Panaderia y pasteleria,Dia
Huevos de chocolate con sorpresa 3 unidades Kinder caja 60 g,"Azúcar, chocolates y caramelos",Chocolates y bombones,KILO,58.17,3.49,"Azúcar, caramelos y chocolate",Kinder
Agua mineral con gas Dia botella 1.5 l,"Agua, refrescos y zumos",Agua,LITRO,0.27,0.41,Agua y refrescos,Dia
Preparado para tarta de oreo Royal caja 215 g,"Panes, harinas y masas",Preparados para postres,KILO,18.56,3.99,Panaderia y pasteleria,otra
Bizcocho casero Royal caja 375 g,"Panes, harinas y masas",Preparados para postres,KILO,8.51,3.19,Panaderia y pasteleria,otra
Agua mineral natural Font Vella botella 1.5 l,"Agua, refrescos y zumos",Agua,LITRO,0.49,0.73,Agua y refrescos,otra
Bífidus desnatado con ciruelas Activia vaso 480 g,Yogures y postres,Yogures bífidus y colesterol,KILO,6.23,2.99,Postres y yogures,otra
Agua mineral natural Cabreiroá botella 1.5 l,"Agua, refrescos y zumos",Agua,LITRO,0.53,0.79,Agua y refrescos,otra
Bífidus desnatado con kiwi Activia pack 4 x 120 g,Yogures y postres,Yogures bífidus y colesterol,KILO,6.23,2.99,Postres y yogures,otra
Agua mineral con gas Vichy botella 1 l,"Agua, refrescos y zumos",Agua,LITRO,1.49,1.49,Agua y refrescos,otra
Barra de pan peregrina El molino de Dia bolsa 250 g,"Panes, harinas y masas",Pan recien horneado,KILO,2.88,0.72,Panaderia y pasteleria,Dia
Cremoso con fibra y cereales Bífidus Dia pack 4 x 125 g,Yogures y postres,Yogures bífidus y colesterol,KILO,2.58,1.29,Postres y yogures,Dia
Agua mineral natural Font Vella botella 2 l,"Agua, refrescos y zumos",Agua,LITRO,0.49,0.97,Agua y refrescos,otra
Bebida láctea de fresa Danacol pack 6 x 100 g,Yogures y postres,Yogures bífidus y colesterol,KILO,7.48,4.49,Postres y yogures,Danacol
Preparado para flan contiene caramelo líquido Royal caja 232.5 g,"Panes, harinas y masas",Preparados para postres,KILO,9.68,2.25,Panaderia y pasteleria,otra
Agua mineral natural Solán de Cabras garrafa 5 l,"Agua, refrescos y zumos",Agua,LITRO,0.54,2.69,Agua y refrescos,otra
Fideos de colores para decorar Dulcinea bolsa 150 g,"Panes, harinas y masas",Preparados para postres,KILO,11.0,1.65,Panaderia y pasteleria,otra
Fideos de chocolate para decorar Dulcinea bolsa 150 g,"Panes, harinas y masas",Preparados para postres,KILO,11.0,1.65,Panaderia y pasteleria,otra
Picatostes fritos El molino de Dia bolsa 75 g,"Panes, harinas y masas",Picos y panes tostados,KILO,10.53,0.79,Panaderia y pasteleria,Dia
Bífidus sabor mango y papaya con soja Activia pack 4 x 120 g,Yogures y postres,Yogures bífidus y colesterol,KILO,6.23,2.99,Postres y yogures,otra
Picos integrales El molino de Dia bolsa 250 g,"Panes, harinas y masas",Picos y panes tostados,KILO,2.6,0.65,Panaderia y pasteleria,Dia
