Nombre,Categoria1,Categoria2,UM,Precio Unitario,Precio,categoria_principal,Marca
Hélices 100% de garbanzo Gallo bolsa 250 g,"Arroz, pastas y legumbres",Pastas,KILO,7.16,1.79,"Arroz, legumbres y pastas",otra
Pasta Mickey and friends Disney Gallo bolsa 300 g,"Arroz, pastas y legumbres",Pastas,KILO,7.0,2.1,"Arroz, legumbres y pastas",otra
Espirales con remolacha sin gluten Al Diante Dia bolsa 250 g,"Arroz, pastas y legumbres",Pastas,KILO,7.8,1.95,"Arroz, legumbres y pastas",Dia
Espirales sin gluten Al Diante Dia bolsa 250 g,"Arroz, pastas y legumbres",Pastas,KILO,7.8,1.95,"Arroz, legumbres y pastas",Dia
Pasta tagliatelle con albahaca sin gluten Al Diante Dia bolsa 250 g,"Arroz, pastas y legumbres",Pastas,KILO,7.8,1.95,"Arroz, legumbres y pastas",Dia
Pasta tagliatelle sin gluten Al Diante Dia bolsa 250 g,"Arroz, pastas y legumbres",Pastas,KILO,7.8,1.95,"Arroz, legumbres y pastas",Dia
Fideo grueso Al Diante Dia bolsa 500 g,"Arroz, pastas y legumbres",Pastas,KILO,1.64,0.82,"Arroz, legumbres y pastas",Dia
Aceite de semillas especial freidora de aire La española spray 200 ml,"Aceites, salsas y especias",Aceites,LITRO,12.45,2.49,"Aceite, especias y salsas",otra
Aceite de oliva virgen extra Dcoop botella 1 l,"Aceites, salsas y especias",Aceites,LITRO,12.45,12.45,"Aceite, especias y salsas",otra
Aceite de girasol La masía garrafa 5 l,"Aceites, salsas y especias",Aceites,LITRO,1.75,8.75,"Aceite, especias y salsas",otra
Aceite de oliva virgen extra a la guindilla La española botella 250 ml,"Aceites, salsas y especias",Aceites,LITRO,15.96,3.99,"Aceite, especias y salsas",otra
Aceite de oliva virgen Coosur botella 1 l,"Aceites, salsas y especias",Aceites,LITRO,14.5,14.5,"Aceite, especias y salsas",otra
Aceite de oliva virgen extra La española botella 500 ml,"Aceites, salsas y especias",Aceites,LITRO,15.38,7.69,"Aceite, especias y salsas",otra
Aceite de oliva virgen extra ecológico Oro de Génave botella 500 ml,"Aceites, salsas y especias",Aceites,LITRO,15.98,7.99,"Aceite, especias y salsas",otra
Aceite de oliva virgen extra al ajo La española botella 250 ml,"Aceites, salsas y especias",Aceites,LITRO,15.96,3.99,"Aceite, especias y salsas",otra
Aceite de oliva virgen extra a la trufa blanca La española botella 250 ml,"Aceites, salsas y especias",Aceites,LITRO,15.96,3.99,"Aceite, especias y salsas",otra
Aceite de girasol Coosol garrafa 5 l,"Aceites, salsas y especias",Aceites,LITRO,2.2,10.99,"Aceite, especias y salsas",otra
Aceite de coco virgen extra bio Bio para todos frasco 225 ml,"Aceites, salsas y especias",Aceites,LITRO,17.73,3.99,"Aceite, especias y salsas",otra
Aceite de oliva virgen extra Jaencoop botella 250 ml,"Aceites, salsas y especias",Aceites,LITRO,15.96,3.99,"Aceite, especias y salsas",otra
Aceite de oliva virgen extra Jaencoop botella 1 l,"Aceites, salsas y especias",Aceites,LITRO,12.99,12.99,"Aceite, especias y salsas",otra
Aceite de oliva virgen extra Carbonell spray 200 ml,"Aceites, salsas y especias",Aceites,LITRO,21.95,4.39,"Aceite, especias y salsas",otra
Aceite de oliva virgen La Almazara del Olivar de Dia botella 1 l,"Aceites, salsas y especias",Aceites,LITRO,9.55,9.55,"Aceite, especias y salsas",Almazara del Olivar
Aceite de girasol especial para freír Koipe botella 1 l,"Aceites, salsas y especias",Aceites,LITRO,2.69,2.69,"Aceite, especias y salsas",otra
Aceite de girasol Koipe botella 1 l,"Aceites, salsas y especias",Aceites,LITRO,2.59,2.59,"Aceite, especias y salsas",otra
Aceite de orujo de oliva La masía botella 1 l,"Aceites, salsas y especias",Aceites,LITRO,5.69,5.69,"Aceite, especias y salsas",otra
Aceite de oliva intenso Carbonell botella 1 l,"Aceites, salsas y especias",Aceites,LITRO,13.89,13.89,"Aceite, especias y salsas",otra
Vinagre de vino blanco Aliña tu Dia botella 1 l,"Aceites, salsas y especias",Vinagres y aliños,LITRO,0.7,0.7,"Aceite, especias y salsas",Dia
Aderezo de limón Aliña tu Dia botella 50 cl,"Aceites, salsas y especias",Vinagres y aliños,LITRO,1.98,0.99,"Aceite, especias y salsas",Dia
Vinagre de manzana Ybarra botella 1 l,"Aceites, salsas y especias",Vinagres y aliños,LITRO,1.95,1.95,"Aceite, especias y salsas",otra
Crema de vinagre al jerez Vulpi botella 400 ml,"Aceites, salsas y especias",Vinagres y aliños,LITRO,4.98,1.99,"Aceite, especias y salsas",otra
Crema vinagre de módena sin azúcares añadidos Vulpi botella 400 ml,"Aceites, salsas y especias",Vinagres y aliños,LITRO,4.98,1.99,"Aceite, especias y salsas",otra
Vinagre de jerez reserva dop Delicias de Dia botella 250 ml,"Aceites, salsas y especias",Vinagres y aliños,LITRO,7.96,1.99,"Aceite, especias y salsas",Dia
Vinagre de manzana ecológico Riojavina botella 500 ml,"Aceites, salsas y especias",Vinagres y aliños,LITRO,4.7,2.35,"Aceite, especias y salsas",otra
Vinagre de vino blanco Borges botella 1 l,"Aceites, salsas y especias",Vinagres y aliños,LITRO,1.15,1.15,"Aceite, especias y salsas",otra
Vinagre de vino tinto Borges botella 1 l,"Aceites, salsas y especias",Vinagres y aliños,LITRO,1.15,1.15,"Aceite, especias y salsas",otra
Crema de vinagre con Pedro Ximénez Aliña tu Dia botella 250 ml,"Aceites, salsas y especias",Vinagres y aliños,LITRO,9.4,2.35,"Aceite, especias y salsas",Dia
Vinagre de sidra Mayador botella 75 cl,"Aceites, salsas y especias",Vinagres y aliños,LITRO,3.72,2.79,"Aceite, especias y salsas",otra
Vinagre de vino blanco Ybarra botella 1 l,"Aceites, salsas y especias",Vinagres y aliños,LITRO,1.05,1.05,"Aceite, especias y salsas",otra
Crema de vinagre de módena con frambuesa Aliña tu Dia botella 250 ml,"Aceites, salsas y especias",Vinagres y aliños,LITRO,9.4,2.35,"Aceite, especias y salsas",Dia
Crema de vinagre de módena Aliña tu Dia botella 250 ml,"Aceites, salsas y especias",Vinagres y aliños,LITRO,7.96,1.99,"Aceite, especias y salsas",Dia
Vinagre balsámico de módena Selección Mundial de Dia botella 500 ml,"Aceites, salsas y especias",Vinagres y aliños,LITRO,4.9,2.45,"Aceite, especias y salsas",Selección Mundial
Sal marina de mesa fina Dia paquete 1 Kg,"Aceites, salsas y especias",Sal y especias,KILO,0.35,0.35,"Aceite, especias y salsas",Dia
Hojas de laurel Dani bolsa 10 g,"Aceites, salsas y especias",Sal y especias,KILO,89.0,0.89,"Aceite, especias y salsas",otra
Sazonador bacon El avion frasco 80 g,"Aceites, salsas y especias",Sal y especias,KILO,34.38,2.75,"Aceite, especias y salsas",otra
Tomillo  Vegecampo de Dia frasco 25 g,"Aceites, salsas y especias",Sal y especias,KILO,35.6,0.89,"Aceite, especias y salsas",Dia
Pimienta negra Vegecampo de Dia frasco 65 g,"Aceites, salsas y especias",Sal y especias,KILO,14.62,0.95,"Aceite, especias y salsas",Dia
Pimienta blanca molida Vegecampo de Dia frasco 65 g,"Aceites, salsas y especias",Sal y especias,KILO,29.23,1.9,"Aceite, especias y salsas",Dia
Perejil Vegecampo de Dia frasco 13 g,"Aceites, salsas y especias",Sal y especias,KILO,50.0,0.65,"Aceite, especias y salsas",Dia
Jengibre molido Vegecampo de Dia frasco 50 g,"Aceites, salsas y especias",Sal y especias,KILO,31.8,1.59,"Aceite, especias y salsas",Dia
Eneldo  Vegecampo de Dia frasco 20 g,"Aceites, salsas y especias",Sal y especias,KILO,87.5,1.75,"Aceite, especias y salsas",Dia
Curry Vegecampo de Dia frasco 55 g,"Aceites, salsas y especias",Sal y especias,KILO,20.0,1.1,"Aceite, especias y salsas",Dia
Comino molido Vegecampo de Dia frasco 60 g,"Aceites, salsas y especias",Sal y especias,KILO,18.17,1.09,"Aceite, especias y salsas",Dia
Cilantro Vegecampo de Dia frasco 15 g,"Aceites, salsas y especias",Sal y especias,KILO,123.33,1.85,"Aceite, especias y salsas",Dia
Cebolla en polvo Vegecampo de Dia frasco 60 g,"Aceites, salsas y especias",Sal y especias,KILO,15.83,0.95,"Aceite, especias y salsas",Dia
Canela molida Vegecampo de Dia frasco 45 g,"Aceites, salsas y especias",Sal y especias,KILO,18.22,0.82,"Aceite, especias y salsas",Dia
Canela en rama Vegecampo de Dia frasco 20 g,"Aceites, salsas y especias",Sal y especias,KILO,67.5,1.35,"Aceite, especias y salsas",Dia
Ajo en polvo Vegecampo de Dia frasco 85 g,"Aceites, salsas y especias",Sal y especias,KILO,10.0,0.85,"Aceite, especias y salsas",Dia
Sazonador patatas fritas El avion frasco 65 g,"Aceites, salsas y especias",Sal y especias,KILO,43.85,2.85,"Aceite, especias y salsas",otra
Sazonador pasta pizza El avion frasco 60 g,"Aceites, salsas y especias",Sal y especias,KILO,47.5,2.85,"Aceite, especias y salsas",otra
Sazonador chili-lima El avion frasco 70 g,"Aceites, salsas y especias",Sal y especias,KILO,40.71,2.85,"Aceite, especias y salsas",otra
Sazonador pollo El avion frasco 110 g,"Aceites, salsas y especias",Sal y especias,KILO,25.91,2.85,"Aceite, especias y salsas",otra
Sazonador barbacoa El avion frasco 90 g,"Aceites, salsas y especias",Sal y especias,KILO,31.67,2.85,"Aceite, especias y salsas",otra
Pimentón picante de la Vera Vega Cáceres lata 75 g,"Aceites, salsas y especias",Sal y especias,KILO,27.87,2.09,"Aceite, especias y salsas",otra
Pimentón dulce de La Vera Vega Cáceres lata 75 g,"Aceites, salsas y especias",Sal y especias,KILO,26.0,1.95,"Aceite, especias y salsas",otra
Romero Vegecampo de Dia frasco 30 g,"Aceites, salsas y especias",Sal y especias,KILO,31.67,0.95,"Aceite, especias y salsas",Dia
Pimentón picante Vegecampo de Dia frasco 58 g,"Aceites, salsas y especias",Sal y especias,KILO,21.55,1.25,"Aceite, especias y salsas",Dia
Pimentón dulce Vegecampo de Dia frasco 58 g,"Aceites, salsas y especias",Sal y especias,KILO,15.52,0.9,"Aceite, especias y salsas",Dia
Nuez moscada molida Vegecampo de Dia frasco 60 g,"Aceites, salsas y especias",Sal y especias,KILO,27.5,1.65,"Aceite, especias y salsas",Dia
Hierbas provenzales  Vegecampo de Dia frasco 22 g,"Aceites, salsas y especias",Sal y especias,KILO,45.0,0.99,"Aceite, especias y salsas",Dia
Cúrcuma  Vegecampo de Dia frasco 60 g,"Aceites, salsas y especias",Sal y especias,KILO,20.0,1.2,"Aceite, especias y salsas",Dia
Pan de molde 100% integral sin corteza El molino de Dia bolsa 450 g,"Panes, harinas y masas","Pan de molde, perritos y hamburguesas.",KILO,3.0,1.35,Panaderia y pasteleria,Dia
Pan de molde rústico El molino de Dia bolsa 600 g,"Panes, harinas y masas","Pan de molde, perritos y hamburguesas.",KILO,2.92,1.75,Panaderia y pasteleria,Dia
Pan de hamburguesas Bimbo bolsa 300 g,"Panes, harinas y masas","Pan de molde, perritos y hamburguesas.",KILO,8.3,2.49,Panaderia y pasteleria,otra
Salsa ali oli Chovi tarrina 180 g,"Aceites, salsas y especias","Mayonesa, ketchup y otras salsas",KILO,7.5,1.35,"Aceite, especias y salsas",otra
Ketchup top down Heinz bote 460 g,"Aceites, salsas y especias","Mayonesa, ketchup y otras salsas",KILO,7.15,3.29,"Aceite, especias y salsas",otra
Salsa sriracha hot chilli mayo Go-tang frasco 215 ml,"Aceites, salsas y especias","Mayonesa, ketchup y otras salsas",LITRO,15.77,3.39,"Aceite, especias y salsas",otra
Salsa de tomate con queso grana padano Gallo frasco 350 g,"Aceites, salsas y especias","Mayonesa, ketchup y otras salsas",KILO,7.4,2.59,"Aceite, especias y salsas",otra
Salsa dulce de pimiento y jalapeño La vieja fabrica frasco 280 g,"Aceites, salsas y especias","Mayonesa, ketchup y otras salsas",KILO,9.96,2.79,"Aceite, especias y salsas",otra
Chutney de mango y cebolla La vieja fabrica frasco 280 g,"Aceites, salsas y especias","Mayonesa, ketchup y otras salsas",KILO,9.96,2.79,"Aceite, especias y salsas",otra
Salsa barbacoa cero azúcar Prima bote 265 g,"Aceites, salsas y especias","Mayonesa, ketchup y otras salsas",KILO,10.15,2.69,"Aceite, especias y salsas",otra
Mostaza cero azúcar Prima bote 265 g,"Aceites, salsas y especias","Mayonesa, ketchup y otras salsas",KILO,11.28,2.99,"Aceite, especias y salsas",otra
Mostaza original Prima bote 265 g,"Aceites, salsas y especias","Mayonesa, ketchup y otras salsas",KILO,8.49,2.25,"Aceite, especias y salsas",otra
Salsa barbacoa estilo tex mex Salseo de Dia bote 350 g,"Aceites, salsas y especias","Mayonesa, ketchup y otras salsas",KILO,5.69,1.99,"Aceite, especias y salsas",Dia
Salsa boloñesa Al Diante Dia frasco 300 g,"Aceites, salsas y especias","Mayonesa, ketchup y otras salsas",KILO,5.33,1.6,"Aceite, especias y salsas",Dia
Salsa pesto rojo Al Diante Dia frasco 185 g,"Aceites, salsas y especias","Mayonesa, ketchup y otras salsas",KILO,12.38,2.29,"Aceite, especias y salsas",Dia
Salsa pesto verde Al Diante Dia frasco 185 g,"Aceites, salsas y especias","Mayonesa, ketchup y otras salsas",KILO,12.38,2.29,"Aceite, especias y salsas",Dia
Salsa ricotta Al Diante Dia frasco 300 g,"Aceites, salsas y especias","Mayonesa, ketchup y otras salsas",KILO,5.17,1.55,"Aceite, especias y salsas",Dia
Salsa napolitana Al Diante Dia frasco 300 g,"Aceites, salsas y especias","Mayonesa, ketchup y otras salsas",KILO,5.17,1.55,"Aceite, especias y salsas",Dia
Salsa arrabiata Al Diante Dia frasco 300 g,"Aceites, salsas y especias","Mayonesa, ketchup y otras salsas",KILO,5.17,1.55,"Aceite, especias y salsas",Dia
Salsa ranchera Salseo de Dia bote 300 g,"Aceites, salsas y especias","Mayonesa, ketchup y otras salsas",KILO,5.17,1.55,"Aceite, especias y salsas",Dia
Salsa de boletus Salseo de Dia frasco 210 g,"Aceites, salsas y especias","Mayonesa, ketchup y otras salsas",KILO,9.29,1.95,"Aceite, especias y salsas",Dia
Salsa de mostaza y eneldo Salseo de Dia frasco 210 g,"Aceites, salsas y especias","Mayonesa, ketchup y otras salsas",KILO,9.29,1.95,"Aceite, especias y salsas",Dia
Salsa de pedro ximénez Salseo de Dia frasco 210 g,"Aceites, salsas y especias","Mayonesa, ketchup y otras salsas",KILO,9.29,1.95,"Aceite, especias y salsas",Dia
Leche entera Dia Láctea brik 6 x 1 l,"Leche, huevos y mantequilla",Leche,LITRO,0.91,5.46,"Huevos , leche y mantequilla",Dia Láctea
Leche entera Dia Láctea brik 1 l,"Leche, huevos y mantequilla",Leche,LITRO,0.91,0.91,"Huevos , leche y mantequilla",Dia Láctea
Leche desnatada Dia Láctea brik 6 x 1 l,"Leche, huevos y mantequilla",Leche,LITRO,0.8,4.8,"Huevos , leche y mantequilla",Dia Láctea
Leche desnatada Dia Láctea brik 1 l,"Leche, huevos y mantequilla",Leche,LITRO,0.8,0.8,"Huevos , leche y mantequilla",Dia Láctea
Leche condensada Dia Láctea lata 1 Kg,"Leche, huevos y mantequilla",Leche,KILO,3.85,3.85,"Huevos , leche y mantequilla",Dia Láctea
Leche condensada Dia Láctea bote 450 g,"Leche, huevos y mantequilla",Leche,KILO,5.76,2.59,"Huevos , leche y mantequilla",Dia Láctea
Leche semidesnatada Central Lechera Asturiana botella 6 x 1.5 l,"Leche, huevos y mantequilla",Leche,LITRO,1.1,9.9,"Huevos , leche y mantequilla",Central Lechera Asturiana
Leche semidesnatada Central Lechera Asturiana botella 1.5 l,"Leche, huevos y mantequilla",Leche,LITRO,1.1,1.65,"Huevos , leche y mantequilla",Central Lechera Asturiana
Leche semidesnatada Dia Láctea brik 6 x 1 l,"Leche, huevos y mantequilla",Leche,LITRO,0.83,4.98,"Huevos , leche y mantequilla",Dia Láctea
Leche semidesnatada Dia Láctea brik 1 l,"Leche, huevos y mantequilla",Leche,LITRO,0.83,0.83,"Huevos , leche y mantequilla",Dia Láctea
Leche desnatada omega 3 Dia Láctea brik 1 l,"Leche, huevos y mantequilla",Leche,LITRO,1.1,1.1,"Huevos , leche y mantequilla",Dia Láctea
Leche desnatada calcio Dia Láctea brik 1 l,"Leche, huevos y mantequilla",Leche,LITRO,0.93,0.93,"Huevos , leche y mantequilla",Dia Láctea
Leche condensada La lechera bote 450 g,"Leche, huevos y mantequilla",Leche,KILO,8.42,3.79,"Huevos , leche y mantequilla",otra
Leche semidesnatada calcio Dia Láctea brik 1 l,"Leche, huevos y mantequilla",Leche,LITRO,0.96,0.96,"Huevos , leche y mantequilla",Dia Láctea
Leche semidesnatada Lauki brik 1 l,"Leche, huevos y mantequilla",Leche,LITRO,0.99,0.99,"Huevos , leche y mantequilla",otra
Bebida de soja Dia Vital brik 1 l,"Leche, huevos y mantequilla",Bebidas vegetales,LITRO,0.7,0.7,"Huevos , leche y mantequilla",Dia
Bebida de soja con calcio Vegedia brik 1 l,"Leche, huevos y mantequilla",Bebidas vegetales,LITRO,0.7,0.7,"Huevos , leche y mantequilla",otra
Bebida de soja 0% azúcares Vegedia brik 1 l,"Leche, huevos y mantequilla",Bebidas vegetales,LITRO,0.8,0.8,"Huevos , leche y mantequilla",otra
Bebida de avena 0% azúcares Vegedia brik 1 l,"Leche, huevos y mantequilla",Bebidas vegetales,LITRO,0.8,0.8,"Huevos , leche y mantequilla",otra
Bebida de avena sin azúcar Alpro brik 1 l,"Leche, huevos y mantequilla",Bebidas vegetales,LITRO,1.99,1.99,"Huevos , leche y mantequilla",otra
Bebida de almendras sin azúcar Alpro brik 1 l,"Leche, huevos y mantequilla",Bebidas vegetales,LITRO,1.99,1.99,"Huevos , leche y mantequilla",otra
Bebida de avena Yosoy brik 1 l,"Leche, huevos y mantequilla",Bebidas vegetales,LITRO,1.59,1.59,"Huevos , leche y mantequilla",otra
Bebida de almendras 0% azúcares Vegedia brik 1 l,"Leche, huevos y mantequilla",Bebidas vegetales,LITRO,1.3,1.3,"Huevos , leche y mantequilla",otra
Bebida de arroz Vegedia brik 1 l,"Leche, huevos y mantequilla",Bebidas vegetales,LITRO,0.99,0.99,"Huevos , leche y mantequilla",otra
Bebida de avena Vegedia brik 1 l,"Leche, huevos y mantequilla",Bebidas vegetales,LITRO,0.95,0.95,"Huevos , leche y mantequilla",otra
Bebida de avena con calcio Vegedia brik 1 l,"Leche, huevos y mantequilla",Bebidas vegetales,LITRO,0.99,0.99,"Huevos , leche y mantequilla",otra
Bebida de avena Pascual Vivesoy brik 1 l,"Leche, huevos y mantequilla",Bebidas vegetales,LITRO,1.89,1.89,"Huevos , leche y mantequilla",otra
Bebida de almendras Alpro brik 1 l,"Leche, huevos y mantequilla",Bebidas vegetales,LITRO,1.99,1.99,"Huevos , leche y mantequilla",otra
Bebida de avena Alpro brik 1 l,"Leche, huevos y mantequilla",Bebidas vegetales,LITRO,1.99,1.99,"Huevos , leche y mantequilla",otra
Bebida de soja ligera Alpro brik 1 l,"Leche, huevos y mantequilla",Bebidas vegetales,LITRO,1.99,1.99,"Huevos , leche y mantequilla",otra
Bebida de soja ligera sin azúcar Pascual Vivesoy brik 1 l,"Leche, huevos y mantequilla",Bebidas vegetales,LITRO,1.99,1.99,"Huevos , leche y mantequilla",otra
Horchata Chufi botella 1 l,"Leche, huevos y mantequilla",Batidos y horchatas,LITRO,1.89,1.89,"Huevos , leche y mantequilla",otra
Batido de chocolate Puleva botella 1 l,"Leche, huevos y mantequilla",Batidos y horchatas,LITRO,2.05,2.05,"Huevos , leche y mantequilla",otra
Horchata premium Dia brik 1 l,"Leche, huevos y mantequilla",Batidos y horchatas,LITRO,1.69,1.69,"Huevos , leche y mantequilla",Dia
Batido de chocolate Dia Láctea brik 6 x 200 ml,"Leche, huevos y mantequilla",Batidos y horchatas,LITRO,1.17,1.4,"Huevos , leche y mantequilla",Dia Láctea
Batido de cacao energy Colacao botella 4 x 188 ml,"Leche, huevos y mantequilla",Batidos y horchatas,LITRO,3.55,2.67,"Huevos , leche y mantequilla",Colacao
Bebida de chufa sin azúcares añadidos Dia brik 1 l,"Leche, huevos y mantequilla",Batidos y horchatas,LITRO,1.55,1.55,"Huevos , leche y mantequilla",Dia
Horchata Dia brik 3 x 200 ml,"Leche, huevos y mantequilla",Batidos y horchatas,LITRO,2.32,1.39,"Huevos , leche y mantequilla",Dia
Horchata premium Or xata brik 1 l,"Leche, huevos y mantequilla",Batidos y horchatas,LITRO,1.79,1.79,"Huevos , leche y mantequilla",otra
Batido de chocolate Cacaolat botella 4 x 200 ml,"Leche, huevos y mantequilla",Batidos y horchatas,LITRO,3.33,2.66,"Huevos , leche y mantequilla",otra
Batido de chocolate enriquecido con proteínas Valio botella 260 g,"Agua, refrescos y zumos","Tés fríos, cafés frios",KILO,8.65,2.25,Agua y refrescos,otra
Horchata Dia botella 1 l,"Leche, huevos y mantequilla",Batidos y horchatas,LITRO,1.2,1.2,"Huevos , leche y mantequilla",Dia
Batido de chocolate sin lactosa Puleva brik 6 x 200 ml,"Leche, huevos y mantequilla",Batidos y horchatas,LITRO,2.49,2.99,"Huevos , leche y mantequilla",otra
Batido de chocolate shake ColaCao vaso 200 ml,"Leche, huevos y mantequilla",Batidos y horchatas,LITRO,7.8,1.56,"Huevos , leche y mantequilla",otra
Batido de chocolate 0% sin azúcar añadido Cacaolat botella 1 l,"Leche, huevos y mantequilla",Batidos y horchatas,LITRO,2.5,2.5,"Huevos , leche y mantequilla",otra
Batido de chocolate Cacaolat botella 1 l,"Leche, huevos y mantequilla",Batidos y horchatas,LITRO,2.4,2.4,"Huevos , leche y mantequilla",otra
Batido de vainilla Dia lactea brik 6 x 200 ml,"Leche, huevos y mantequilla",Batidos y horchatas,LITRO,1.29,1.55,"Huevos , leche y mantequilla",Dia
Batido de fresa Dia lactea brik 6 x 200 ml,"Leche, huevos y mantequilla",Batidos y horchatas,LITRO,1.29,1.55,"Huevos , leche y mantequilla",Dia
Batido al cacao Dia botella 1 l,"Leche, huevos y mantequilla",Batidos y horchatas,LITRO,1.19,1.19,"Huevos , leche y mantequilla",Dia
Leche merengada canela y limón Dia botella 1 l,"Leche, huevos y mantequilla",Batidos y horchatas,LITRO,1.65,1.65,"Huevos , leche y mantequilla",Dia
Batido de cacao 90% Dia lactea brik 6 x 200 ml,"Leche, huevos y mantequilla",Batidos y horchatas,LITRO,1.38,1.65,"Huevos , leche y mantequilla",Dia
Nata para cocinar Central Lechera Asturiana brik 500 ml,"Leche, huevos y mantequilla",Nata,LITRO,5.5,2.75,"Huevos , leche y mantequilla",Central Lechera Asturiana
Nata montada azucarada Central Lechera Asturiana spray 250 g,"Leche, huevos y mantequilla",Nata,KILO,11.0,2.75,"Huevos , leche y mantequilla",Central Lechera Asturiana
Nata para montar Central Lechera Asturiana brik 500 ml,"Leche, huevos y mantequilla",Nata,LITRO,5.5,2.75,"Huevos , leche y mantequilla",Central Lechera Asturiana
Nata para cocinar 15% m.g Dia Láctea brik 500 ml,"Leche, huevos y mantequilla",Nata,LITRO,2.9,1.45,"Huevos , leche y mantequilla",Dia Láctea
Leche evaporada sin lactosa Ideal brik 525 g,"Leche, huevos y mantequilla",Leche,KILO,5.31,2.79,"Huevos , leche y mantequilla",otra
Leche evaporada Ideal brik 525 g,"Leche, huevos y mantequilla",Leche,KILO,4.36,2.29,"Huevos , leche y mantequilla",otra
Nata para montar Central Lechera Asturiana brik 1 l,"Leche, huevos y mantequilla",Nata,LITRO,4.75,4.75,"Huevos , leche y mantequilla",Central Lechera Asturiana
Nata para cocinar culinaria Dia lactea brik 3 x 200 ml,"Leche, huevos y mantequilla",Nata,LITRO,2.92,1.75,"Huevos , leche y mantequilla",Dia
Nata para montar Dia lactea brik 3 x 200 ml,"Leche, huevos y mantequilla",Nata,LITRO,3.25,1.95,"Huevos , leche y mantequilla",Dia
Huevos frescos categoría A clase XL Dia bandeja 6 unidades,"Leche, huevos y mantequilla",Huevos,DOCENA,3.38,1.69,"Huevos , leche y mantequilla",Dia
Huevos ecológicos categoría A clase M/L Dia bandeja 6 unidades,"Leche, huevos y mantequilla",Huevos,DOCENA,4.98,2.49,"Huevos , leche y mantequilla",Dia
Huevos camperos categoría A clase M/L Dia bandeja 10 unidades,"Leche, huevos y mantequilla",Huevos,DOCENA,2.99,2.49,"Huevos , leche y mantequilla",Dia
Huevos frescos de gallinas criadas en suelo categoría A clase M/L Dia bandeja 12 unidades,"Leche, huevos y mantequilla",Huevos,DOCENA,2.45,2.45,"Huevos , leche y mantequilla",Dia
Huevos frescos categoría A clase M La receta bandeja 24 unidades,"Leche, huevos y mantequilla",Huevos,DOCENA,1.9,3.8,"Huevos , leche y mantequilla",otra
Claras de huevo pasteurizadas Ovonatur botella 500 ml,"Leche, huevos y mantequilla",Huevos,LITRO,3.9,1.95,"Huevos , leche y mantequilla",otra
Huevos frescos categoría A clase XL Huevos Garrido caja 6 unidades,"Leche, huevos y mantequilla",Huevos,DOCENA,3.38,1.69,"Huevos , leche y mantequilla",otra
Huevos frescos categoría A clase M Huevos Garrido caja 24 unidades,"Leche, huevos y mantequilla",Huevos,DOCENA,1.9,3.8,"Huevos , leche y mantequilla",otra
Huevos frescos categoría A clase L Huevos Garrido caja 12 unidades,"Leche, huevos y mantequilla",Huevos,DOCENA,2.26,2.26,"Huevos , leche y mantequilla",otra
Huevos frescos categoría A clase M Huevos Garrido caja 12 unidades,"Leche, huevos y mantequilla",Huevos,DOCENA,2.02,2.02,"Huevos , leche y mantequilla",otra
Huevos frescos categoría A clase M Dia bandeja 12 unidades,"Leche, huevos y mantequilla",Huevos,DOCENA,2.02,2.02,"Huevos , leche y mantequilla",Dia
Huevos frescos categoría A clase L Dia bandeja 12 unidades,"Leche, huevos y mantequilla",Huevos,DOCENA,2.26,2.26,"Huevos , leche y mantequilla",Dia
Margarina vitaminada con sal Diasol tarrina 500 g,"Leche, huevos y mantequilla",Mantequilla y margarina,KILO,2.9,1.45,"Huevos , leche y mantequilla",Dia
Margarina vitaminada Diasol tarrina 500 g,"Leche, huevos y mantequilla",Mantequilla y margarina,KILO,2.9,1.45,"Huevos , leche y mantequilla",Dia
Margarina ligera Diasol tarrina 500 g,"Leche, huevos y mantequilla",Mantequilla y margarina,KILO,2.8,1.4,"Huevos , leche y mantequilla",Dia
Mantequilla tradicional Central Lechera Asturiana tarrina 250 g,"Leche, huevos y mantequilla",Mantequilla y margarina,KILO,14.2,3.55,"Huevos , leche y mantequilla",Central Lechera Asturiana
Margarina con un toque de aceite de oliva Flora tarrina 225 g,"Leche, huevos y mantequilla",Mantequilla y margarina,KILO,8.84,1.99,"Huevos , leche y mantequilla",otra
Margarina rica en omega 3 Flora tarrina 400 g,"Leche, huevos y mantequilla",Mantequilla y margarina,KILO,7.38,2.95,"Huevos , leche y mantequilla",otra
Margarina con sal Tulipán tarrina 400 g,"Leche, huevos y mantequilla",Mantequilla y margarina,KILO,7.13,2.85,"Huevos , leche y mantequilla",otra
Margarina Tulipán tarrina 400 g,"Leche, huevos y mantequilla",Mantequilla y margarina,KILO,7.13,2.85,"Huevos , leche y mantequilla",otra
Mantequilla tradicional en rulo Central Lechera Asturiana 500 g,"Leche, huevos y mantequilla",Mantequilla y margarina,KILO,12.3,6.15,"Huevos , leche y mantequilla",Central Lechera Asturiana
Mantequilla con sal Dia Láctea tarrina 250 g,"Leche, huevos y mantequilla",Mantequilla y margarina,KILO,9.8,2.45,"Huevos , leche y mantequilla",Dia Láctea
Mantequilla sin sal Dia Láctea 250 g,"Leche, huevos y mantequilla",Mantequilla y margarina,KILO,7.6,1.9,"Huevos , leche y mantequilla",Dia Láctea
Mantequilla con sal Dia Láctea 250 g,"Leche, huevos y mantequilla",Mantequilla y margarina,KILO,7.6,1.9,"Huevos , leche y mantequilla",Dia Láctea
Mantequilla ligera sin lactosa Central Lechera Asturiana tarrina 250 g,"Leche, huevos y mantequilla",Mantequilla y margarina,KILO,14.6,3.65,"Huevos , leche y mantequilla",Central Lechera Asturiana
