Nombre,Categoria1,Categoria2,UM,Precio Unitario,Precio,categoria_principal,Marca
Pizza serrana Al Punto Dia bandeja 390 g,Pizzas y platos preparados,Pizzas,KILO,6.9,2.69,Pizzas y platos preparados,Dia
Pizza atún y bacon Casa Tarradellas bandeja 405 g,Pizzas y platos preparados,Pizzas,KILO,7.88,3.19,Pizzas y platos preparados,otra
Pizza pollo Al Punto Dia bandeja 400 g,Pizzas y platos preparados,Pizzas,KILO,6.73,2.69,Pizzas y platos preparados,Dia
Pizza pollo Casa Tarradellas bandeja 410 g,Pizzas y platos preparados,Pizzas,KILO,7.78,3.19,Pizzas y platos preparados,otra
Pizza carbonara Al Punto Dia bandeja 400 g,Pizzas y platos preparados,Pizzas,KILO,6.73,2.69,Pizzas y platos preparados,Dia
Flautas de carne y salsa barbacoa con bacon Al Punto Dia bandeja 275 g,Pizzas y platos preparados,Precocinados envasados,KILO,7.09,1.95,Pizzas y platos preparados,Dia
Flautas de bacon y 2 quesos Al Punto Dia bandeja 275 g,Pizzas y platos preparados,Precocinados envasados,KILO,7.09,1.95,Pizzas y platos preparados,Dia
Flautas de pollo y 2 quesos Al Punto Dia bandeja 275 g,Pizzas y platos preparados,Precocinados envasados,KILO,7.09,1.95,Pizzas y platos preparados,Dia
Lasaña boloñesa fresca Al Punto Dia bandeja 800 g,Pizzas y platos preparados,Precocinados envasados,KILO,4.94,3.95,Pizzas y platos preparados,Dia
Hamburguesa vegetariana Garden Gourmet bandeja 150 g,Pizzas y platos preparados,Precocinados envasados,KILO,21.93,3.29,Pizzas y platos preparados,otra
Penne con setas Al Punto Dia bolsa 145 g,Pizzas y platos preparados,Precocinados envasados,KILO,8.62,1.25,Pizzas y platos preparados,Dia
"Lunch bowl espelta, guisantes, alubias, cherry, pimiento rojo y aceitunas Bonduelle bolsa 250 g",Pizzas y platos preparados,Precocinados envasados,KILO,11.96,2.99,Pizzas y platos preparados,otra
Albóndigas de pollo La noreñense lata 415 g,Pizzas y platos preparados,Precocinados envasados,KILO,4.34,1.8,Pizzas y platos preparados,otra
Fusilli a la carbonara Al Punto Dia sobre 145 g,Pizzas y platos preparados,Precocinados envasados,KILO,6.83,0.99,Pizzas y platos preparados,Dia
Callos a la madrileña Gancedo bolsa 500 g,Pizzas y platos preparados,Precocinados envasados,KILO,7.9,3.95,Pizzas y platos preparados,otra
Codillo asado con patatas Al Punto Dia bandeja 450 g,Pizzas y platos preparados,Precocinados envasados,KILO,7.09,3.19,Pizzas y platos preparados,Dia
Lentejas con chorizo Al Punto Dia lata 415 g,Pizzas y platos preparados,Precocinados envasados,KILO,3.2,1.33,Pizzas y platos preparados,Dia
Hummus de pimiento Al Punto Dia tarrina 220 g,Pizzas y platos preparados,Precocinados envasados,KILO,6.77,1.49,Pizzas y platos preparados,Dia
Hummus clásico Al Punto Dia tarrina 220 g,Pizzas y platos preparados,Precocinados envasados,KILO,5.86,1.29,Pizzas y platos preparados,Dia
Fideos orientales classic magic asia Maggi sobre 121 g,Pizzas y platos preparados,Comida internacional,KILO,16.45,1.99,Pizzas y platos preparados,otra
Tortilla integral Al Punto Dia bolsa 320 g,Pizzas y platos preparados,Comida internacional,KILO,4.59,1.47,Pizzas y platos preparados,Dia
Sazonador para burritos suave Old El Paso sobre 40 g,Pizzas y platos preparados,Comida internacional,KILO,34.75,1.39,Pizzas y platos preparados,otra
Chili con carne Old El Paso lata 418 g,Pizzas y platos preparados,Comida internacional,KILO,9.55,3.99,Pizzas y platos preparados,otra
Fideos de arroz Tiger Khan bolsa 375 g,Pizzas y platos preparados,Comida internacional,KILO,8.51,3.19,Pizzas y platos preparados,otra
Tortillas de trigo para burrito Mexifoods bolsa 370 g,Pizzas y platos preparados,Comida internacional,KILO,6.73,2.49,Pizzas y platos preparados,otra
Fideos tradicionales Tiger Khan bolsa 400 g,Pizzas y platos preparados,Comida internacional,KILO,8.38,3.35,Pizzas y platos preparados,otra
Gyozas de langostino al teppanyaki Al Punto Dia bandeja 140 g,Pizzas y platos preparados,Precocinados envasados,KILO,21.07,2.95,Pizzas y platos preparados,Dia
Tortilla pockets Old El Paso caja 223 g,Pizzas y platos preparados,Comida internacional,KILO,15.2,3.39,Pizzas y platos preparados,otra
Gyozas de pollo y verduras al teppanyaki Al Punto Dia bandeja 140 g,Pizzas y platos preparados,Precocinados envasados,KILO,15.64,2.19,Pizzas y platos preparados,Dia
Arroz tres delicias Al Punto Dia bandeja 320 g,Pizzas y platos preparados,Precocinados envasados,KILO,7.78,2.49,Pizzas y platos preparados,Dia
Tortillas mexicanas sin gluten Old El Paso bolsa 216 g,Pizzas y platos preparados,Comida internacional,KILO,15.69,3.39,Pizzas y platos preparados,otra
Fideos orientales pollo Gallina Blanca Yatekomo bote 2 x 60 g,Pizzas y platos preparados,Comida internacional,KILO,25.42,3.05,Pizzas y platos preparados,Yatekomo
Tortillas wraps Old El Paso bolsa 350 g,Pizzas y platos preparados,Comida internacional,KILO,9.69,3.39,Pizzas y platos preparados,otra
Kit fajitas Old El Paso caja 505 g,Pizzas y platos preparados,Comida internacional,KILO,11.86,5.99,Pizzas y platos preparados,otra
Cous cous marroquí Trevijano bandeja 300 g,Pizzas y platos preparados,Comida internacional,KILO,9.83,2.95,Pizzas y platos preparados,otra
Tortilla de patata fresca Al Punto Dia bandeja 600 g,Pizzas y platos preparados,Tortillas y empanadas,KILO,4.92,2.95,Pizzas y platos preparados,Dia
Tortilla vegana Revolu green bolsa 200 g,Pizzas y platos preparados,Tortillas y empanadas,KILO,6.95,1.39,Pizzas y platos preparados,otra
Tortilla de patatas con chorizo Al Punto Dia bandeja 600 g,Pizzas y platos preparados,Tortillas y empanadas,KILO,6.15,3.69,Pizzas y platos preparados,Dia
Tortilla de patatas sin cebolla Al Punto Dia bandeja 600 g,Pizzas y platos preparados,Tortillas y empanadas,KILO,4.32,2.59,Pizzas y platos preparados,Dia
Tortilla de patatas con cebolla Al Punto Dia bandeja 600 g,Pizzas y platos preparados,Tortillas y empanadas,KILO,4.32,2.59,Pizzas y platos preparados,Dia
Tortilla de patatas con espinacas Palacios bandeja 300 g,Pizzas y platos preparados,Tortillas y empanadas,KILO,9.3,2.79,Pizzas y platos preparados,otra
Tortilla de patatas con cebolla Palacios bandeja 650 g,Pizzas y platos preparados,Tortillas y empanadas,KILO,7.52,4.89,Pizzas y platos preparados,otra
Empanada de pollo El molino de Dia 550 g,Pizzas y platos preparados,Tortillas y empanadas,KILO,6.71,3.69,Pizzas y platos preparados,Dia
Empanada de bacalao El molino de Dia bolsa 550 g,Pizzas y platos preparados,Tortillas y empanadas,KILO,6.71,3.69,Pizzas y platos preparados,Dia
Empanada de pollo El molino de Dia bolsa 120 g,Pizzas y platos preparados,Tortillas y empanadas,KILO,5.75,0.69,Pizzas y platos preparados,Dia
Mini tortilla de patatas con cebolla Al Punto Dia bandeja 220 g,Pizzas y platos preparados,Tortillas y empanadas,KILO,4.55,1.0,Pizzas y platos preparados,Dia
Empanada de atún El molino de Dia bolsa 550 g,Pizzas y platos preparados,Tortillas y empanadas,KILO,6.71,3.69,Pizzas y platos preparados,Dia
Empanada de carne El molino de Dia bolsa 550 g,Pizzas y platos preparados,Tortillas y empanadas,KILO,6.71,3.69,Pizzas y platos preparados,Dia
Gazpacho original Alvalle brik 1 l,Pizzas y platos preparados,Gazpachos y salmorejos,LITRO,3.99,3.99,Pizzas y platos preparados,otra
Gazpacho Al Punto Dia brik 1 l,Pizzas y platos preparados,Gazpachos y salmorejos,LITRO,1.55,1.55,Pizzas y platos preparados,Dia
Salmorejo Al Punto Dia brik 33 cl,Pizzas y platos preparados,Gazpachos y salmorejos,LITRO,3.0,0.99,Pizzas y platos preparados,Dia
Gazpacho suave Al Punto Dia brik 33 cl,Pizzas y platos preparados,Gazpachos y salmorejos,LITRO,2.7,0.89,Pizzas y platos preparados,Dia
Gazpacho con almendras Al Punto Dia brik 1 l,Pizzas y platos preparados,Gazpachos y salmorejos,LITRO,2.69,2.69,Pizzas y platos preparados,Dia
Gazpacho suave Al Punto Dia brik 1 l,Pizzas y platos preparados,Gazpachos y salmorejos,LITRO,1.55,1.55,Pizzas y platos preparados,Dia
Salmorejo Al Punto Dia brik 1 l,Pizzas y platos preparados,Gazpachos y salmorejos,LITRO,1.95,1.95,Pizzas y platos preparados,Dia
Gazpacho suave sin pepino Alvalle brik 1 l,Pizzas y platos preparados,Gazpachos y salmorejos,LITRO,3.99,3.99,Pizzas y platos preparados,otra
Agua mineral natural Dia botella 33 cl,"Agua, refrescos y zumos",Agua,LITRO,0.73,0.24,Agua y refrescos,Dia
Agua mineral natural Font Vella botella 50 cl,"Agua, refrescos y zumos",Agua,LITRO,1.1,0.55,Agua y refrescos,otra
Agua mineral natural Font Vella botella 33 cl,"Agua, refrescos y zumos",Agua,LITRO,1.36,0.45,Agua y refrescos,otra
Agua mineral con gas Fonter botella 1 l,"Agua, refrescos y zumos",Agua,LITRO,1.14,1.14,Agua y refrescos,otra
Agua mineral natural Lanjarón botella 1.5 l,"Agua, refrescos y zumos",Agua,LITRO,0.49,0.73,Agua y refrescos,otra
Agua mineral natural Bezoya botella 6 x 1.5 l,"Agua, refrescos y zumos",Agua,LITRO,0.49,4.44,Agua y refrescos,otra
Agua mineral natural Bezoya botella 1.5 l,"Agua, refrescos y zumos",Agua,LITRO,0.49,0.74,Agua y refrescos,otra
Agua mineral natural Aquarel botella 33 cl,"Agua, refrescos y zumos",Agua,LITRO,1.61,0.53,Agua y refrescos,otra
Agua mineral natural Aquarel garrafa 5 l,"Agua, refrescos y zumos",Agua,LITRO,0.35,1.75,Agua y refrescos,otra
Agua mineral natural Aquarel botella 1.5 l,"Agua, refrescos y zumos",Agua,LITRO,0.39,0.59,Agua y refrescos,otra
Agua mineral natural Dia botella 50 cl,"Agua, refrescos y zumos",Agua,LITRO,0.44,0.22,Agua y refrescos,Dia
Agua con gas sabor limón Maison perrier botella 50 cl,"Agua, refrescos y zumos",Agua,LITRO,2.1,1.05,Agua y refrescos,otra
Agua mineral natural Monte pinos botella 1.5 l,"Agua, refrescos y zumos",Agua,LITRO,0.43,0.64,Agua y refrescos,otra
Agua mineral natural Aquarel garrafa 8 l,"Agua, refrescos y zumos",Agua,LITRO,0.44,3.49,Agua y refrescos,otra
Agua mineral natural Fuente primavera botella 1 l,"Agua, refrescos y zumos",Agua,LITRO,0.49,0.49,Agua y refrescos,otra
Agua con gas San Pellegrino botella 50 cl,"Agua, refrescos y zumos",Agua,LITRO,1.98,0.99,Agua y refrescos,otra
Agua con gas Font Vella botella 50 cl,"Agua, refrescos y zumos",Agua,LITRO,1.88,0.94,Agua y refrescos,otra
Agua mineral natural Dia garrafa 5 l,"Agua, refrescos y zumos",Agua,LITRO,0.13,0.65,Agua y refrescos,Dia
Agua mineral natural Dia botella 1.5 l,"Agua, refrescos y zumos",Agua,LITRO,0.17,0.25,Agua y refrescos,Dia
Agua mineral natural alcalina ph9 Ursu9 botella 1.5 l,"Agua, refrescos y zumos",Agua,LITRO,0.5,0.75,Agua y refrescos,otra
Agua mineral natural Aquarel botella 75 cl,"Agua, refrescos y zumos",Agua,LITRO,0.97,0.73,Agua y refrescos,otra
Refresco zero sabor lima Pepsi lata 33 cl,"Agua, refrescos y zumos",Cola,LITRO,2.39,0.79,Agua y refrescos,otra
Refresco de cola zero Coca-Cola botella 2 l,"Agua, refrescos y zumos",Cola,LITRO,1.0,1.99,Agua y refrescos,Coca-Cola
Refresco de cola zero Coca-Cola lata 33 cl,"Agua, refrescos y zumos",Cola,LITRO,2.7,0.89,Agua y refrescos,Coca-Cola
Refresco de cola zero Coca-Cola botella 2 x 1.25 l,"Agua, refrescos y zumos",Cola,LITRO,1.16,2.9,Agua y refrescos,Coca-Cola
Refresco de cola zero zero Coca-Cola botella 1.25 l,"Agua, refrescos y zumos",Cola,LITRO,0.8,1.0,Agua y refrescos,Coca-Cola
Refresco de cola zero azúcar Green cola lata 33 cl,"Agua, refrescos y zumos",Cola,LITRO,2.58,0.85,Agua y refrescos,otra
Refresco de cola zero Pepsi botella 1 l,"Agua, refrescos y zumos",Cola,LITRO,1.25,1.25,Agua y refrescos,otra
Refresco de cola zero sin cafeína Pepsi lata 33 cl,"Agua, refrescos y zumos",Cola,LITRO,2.39,0.79,Agua y refrescos,otra
Refresco de cola clásica Pepsi botella 1 l,"Agua, refrescos y zumos",Cola,LITRO,1.25,1.25,Agua y refrescos,otra
Refresco de cola zero Coca-Cola lata 6 x 200 ml,"Agua, refrescos y zumos",Cola,LITRO,3.33,3.99,Agua y refrescos,Coca-Cola
Refresco de cola zero zero Coca-Cola botella 2 x 2 l,"Agua, refrescos y zumos",Cola,LITRO,0.98,3.9,Agua y refrescos,Coca-Cola
Refresco de cola zero zero Coca-Cola lata 12 x 33 cl,"Agua, refrescos y zumos",Cola,LITRO,2.64,10.44,Agua y refrescos,Coca-Cola
Refresco de lima limón Upss Dia botella 2 l,"Agua, refrescos y zumos","Limón, lima limón",LITRO,0.46,0.92,Agua y refrescos,Dia
Refresco sin gas de limón Upss Dia lata 33 cl,"Agua, refrescos y zumos",Otras bebidas,LITRO,1.48,0.49,Agua y refrescos,Dia
Refresco de limón Upss Dia lata 33 cl,"Agua, refrescos y zumos","Limón, lima limón",LITRO,1.06,0.35,Agua y refrescos,Dia
Refresco de limón sin gas Upss Dia botella 1.5 l,"Agua, refrescos y zumos",Otras bebidas,LITRO,0.7,1.05,Agua y refrescos,Dia
Refresco de limón 6% zumo con gas zero Upss Dia botella 1.5 l,"Agua, refrescos y zumos","Limón, lima limón",LITRO,0.53,0.79,Agua y refrescos,Dia
Refresco de limón zero Schweppes lata 33 cl,"Agua, refrescos y zumos",Otras bebidas,LITRO,2.88,0.95,Agua y refrescos,otra
Refresco de limón Schweppes lata 33 cl,"Agua, refrescos y zumos","Limón, lima limón",LITRO,2.88,0.95,Agua y refrescos,otra
Refresco de lima limón Sprite lata 33 cl,"Agua, refrescos y zumos","Limón, lima limón",LITRO,1.79,0.59,Agua y refrescos,otra
Refresco de limón zero Fanta lata 33 cl,"Agua, refrescos y zumos","Limón, lima limón",LITRO,2.27,0.75,Agua y refrescos,otra
Refresco de lima limón zero Seven up lata 33 cl,"Agua, refrescos y zumos","Limón, lima limón",LITRO,1.79,0.59,Agua y refrescos,otra
Refresco de lima limón Sprite botella 2 l,"Agua, refrescos y zumos","Limón, lima limón",LITRO,0.8,1.59,Agua y refrescos,otra
Refresco en polvo sabor limón Tang bolsa 30 g,"Agua, refrescos y zumos",Otras bebidas,KILO,27.67,0.83,Agua y refrescos,otra
Refresco de limón zero Fanta botella 2 l,"Agua, refrescos y zumos","Limón, lima limón",LITRO,0.9,1.79,Agua y refrescos,otra
Refresco de naranja sin gas Upss Dia lata 33 cl,"Agua, refrescos y zumos",Otras bebidas,LITRO,1.48,0.49,Agua y refrescos,Dia
Refresco sin gas de naranja y zanahoria Upss Dia botella 1.5 l,"Agua, refrescos y zumos",Otras bebidas,LITRO,0.73,1.09,Agua y refrescos,Dia
Refresco de naranja sin gas Upss Dia botella 1.5 l,"Agua, refrescos y zumos",Otras bebidas,LITRO,0.7,1.05,Agua y refrescos,Dia
Bebida de kombucha con kiwi y pepino Komvida botella 250 ml,"Agua, refrescos y zumos",Otras bebidas,LITRO,8.6,2.15,Agua y refrescos,otra
Pajitas comestibles sabor lima Sorbos caja 170 g,"Agua, refrescos y zumos",Otras bebidas,KILO,16.18,2.75,Agua y refrescos,otra
Pajitas comestibles sabor fresa Sorbos caja 170 g,"Agua, refrescos y zumos",Otras bebidas,KILO,16.18,2.75,Agua y refrescos,otra
Refresco multifrutas sin gas Fuensanta botella 33 cl,"Agua, refrescos y zumos",Otras bebidas,LITRO,3.03,1.0,Agua y refrescos,otra
Refresco de sandía sin azúcar Fanta botella 2 l,"Agua, refrescos y zumos",Otras bebidas,LITRO,0.9,1.79,Agua y refrescos,otra
Refresco de sandía sin azúcar Fanta lata 33 cl,"Agua, refrescos y zumos",Otras bebidas,LITRO,2.27,0.75,Agua y refrescos,otra
Agua de coco Vita coco brik 330 ml,"Agua, refrescos y zumos",Otras bebidas,LITRO,5.73,1.89,Agua y refrescos,otra
Agua mineral con frutos rojos zero San Benedetto botella 40 cl,"Agua, refrescos y zumos",Otras bebidas,LITRO,2.23,0.89,Agua y refrescos,otra
Bebida de kombucha con frutos rojos Komvida botella 250 ml,"Agua, refrescos y zumos",Otras bebidas,LITRO,8.6,2.15,Agua y refrescos,otra
Bebida de kombucha con jengibre y limón Komvida botella 250 ml,"Agua, refrescos y zumos",Otras bebidas,LITRO,8.6,2.15,Agua y refrescos,otra
Refresco de fresa sin gas Enjoy botella 1.5 l,"Agua, refrescos y zumos",Otras bebidas,LITRO,0.79,1.19,Agua y refrescos,otra
Bebida multifrutas Surprise drinks botella 300 ml,"Agua, refrescos y zumos",Otras bebidas,LITRO,4.5,1.35,Agua y refrescos,otra
Refresco de zumo de fruta mix zero sin gas San Benedetto botella 40 cl,"Agua, refrescos y zumos",Otras bebidas,LITRO,2.48,0.99,Agua y refrescos,otra
Refresco tropical sin gas Enjoy botella 1.5 l,"Agua, refrescos y zumos",Otras bebidas,LITRO,0.79,1.19,Agua y refrescos,otra
Ginger ale Schweppes lata 33 cl,"Agua, refrescos y zumos",Otras bebidas,LITRO,3.0,0.99,Agua y refrescos,otra
Refresco sin gas de manzana Upss Dia botella 1.5 l,"Agua, refrescos y zumos",Otras bebidas,LITRO,0.7,1.05,Agua y refrescos,Dia
Bitter Bobby Bitter de Dia lata 25 cl,"Agua, refrescos y zumos",Otras bebidas,LITRO,2.2,0.55,Agua y refrescos,Dia
Refresco de té al limón Nestea lata 33 cl,"Agua, refrescos y zumos","Tés fríos, cafés frios",LITRO,3.0,0.99,Agua y refrescos,otra
Refresco de té al limón zero Upss Dia botella 1.5 l,"Agua, refrescos y zumos","Tés fríos, cafés frios",LITRO,0.6,0.9,Agua y refrescos,Dia
Refresco de té al limón Upss Dia botella 1.5 l,"Agua, refrescos y zumos","Tés fríos, cafés frios",LITRO,0.6,0.9,Agua y refrescos,Dia
Refresco de té al melocotón Upss Dia botella 1.5 l,"Agua, refrescos y zumos","Tés fríos, cafés frios",LITRO,0.6,0.9,Agua y refrescos,Dia
Refresco de té de melocotón e hibisco Fuze tea botella 1.25 l,"Agua, refrescos y zumos","Tés fríos, cafés frios",LITRO,1.59,1.99,Agua y refrescos,otra
Refresco de té verde con aloe vera zero San Benedetto botella 50 cl,"Agua, refrescos y zumos","Tés fríos, cafés frios",LITRO,1.38,0.69,Agua y refrescos,otra
Refresco de té de melocotón zero San Benedetto botella 50 cl,"Agua, refrescos y zumos","Tés fríos, cafés frios",LITRO,1.38,0.69,Agua y refrescos,otra
Kombucha sabor limón y jengibre Dia botella 37 cl,"Agua, refrescos y zumos","Tés fríos, cafés frios",LITRO,4.84,1.79,Agua y refrescos,Dia
Kombucha sabor frambuesa Dia botella 37 cl,"Agua, refrescos y zumos","Tés fríos, cafés frios",LITRO,4.84,1.79,Agua y refrescos,Dia
Refresco de té rooibos sabor fresa bajo en calorías Tetería de Dia botella 1.5 l,"Agua, refrescos y zumos","Tés fríos, cafés frios",LITRO,0.7,1.05,Agua y refrescos,Dia
Refresco de té sabor hierbabuena y limón zero Tetería de Dia botella 1.5 l,"Agua, refrescos y zumos","Tés fríos, cafés frios",LITRO,0.7,1.05,Agua y refrescos,Dia
Refresco vitamin té negro con melocotón zero Viwa botella 60 cl,"Agua, refrescos y zumos","Tés fríos, cafés frios",LITRO,2.92,1.75,Agua y refrescos,otra
Café cappuccino Kaiku vaso 370 ml,"Agua, refrescos y zumos","Tés fríos, cafés frios",LITRO,6.73,2.49,Agua y refrescos,otra
Café latte macchiato Cafetería de Dia botella 230 ml,"Agua, refrescos y zumos","Tés fríos, cafés frios",LITRO,4.13,0.95,Agua y refrescos,Dia
Café espresso Cafetería de Dia botella 230 ml,"Agua, refrescos y zumos","Tés fríos, cafés frios",LITRO,4.13,0.95,Agua y refrescos,Dia
Café cappuccino Cafetería de Dia botella 230 ml,"Agua, refrescos y zumos","Tés fríos, cafés frios",LITRO,4.13,0.95,Agua y refrescos,Dia
Refresco de té verde con aloe vera San Benedetto botella 1.5 l,"Agua, refrescos y zumos","Tés fríos, cafés frios",LITRO,0.77,1.15,Agua y refrescos,otra
Refresco de té verde Upss Dia lata 33 cl,"Agua, refrescos y zumos","Tés fríos, cafés frios",LITRO,1.52,0.5,Agua y refrescos,Dia
Café vainilla Kaiku vaso 230 ml,"Agua, refrescos y zumos","Tés fríos, cafés frios",LITRO,7.78,1.79,Agua y refrescos,otra
Café light Kaiku vaso 230 ml,"Agua, refrescos y zumos","Tés fríos, cafés frios",LITRO,7.78,1.79,Agua y refrescos,otra
Café cappuccino Kaiku vaso 230 ml,"Agua, refrescos y zumos","Tés fríos, cafés frios",LITRO,7.78,1.79,Agua y refrescos,otra
Café espresso Kaiku vaso 230 ml,"Agua, refrescos y zumos","Tés fríos, cafés frios",LITRO,7.78,1.79,Agua y refrescos,otra
Refresco de té verde con granada Arizona botella 50 cl,"Agua, refrescos y zumos","Tés fríos, cafés frios",LITRO,2.7,1.35,Agua y refrescos,otra
Refresco de té verde con miel Arizona botella 50 cl,"Agua, refrescos y zumos","Tés fríos, cafés frios",LITRO,2.7,1.35,Agua y refrescos,otra
Refresco de té al limón sin azúcar Nestea lata 33 cl,"Agua, refrescos y zumos","Tés fríos, cafés frios",LITRO,3.0,0.99,Agua y refrescos,otra
Refresco de té al limón sin azúcar Nestea botella 1.5 l,"Agua, refrescos y zumos","Tés fríos, cafés frios",LITRO,1.33,1.99,Agua y refrescos,otra
Tónica Schweppes lata 33 cl,"Agua, refrescos y zumos",Tónicas,LITRO,2.88,0.95,Agua y refrescos,otra
Tónica Toni Tónico de Dia lata 33 cl,"Agua, refrescos y zumos",Tónicas,LITRO,1.12,0.37,Agua y refrescos,Dia
Tónica rosa zero Schweppes lata 33 cl,"Agua, refrescos y zumos",Tónicas,LITRO,2.88,0.95,Agua y refrescos,otra
Tónica premium yuzu Royal Bliss lata 25 cl,"Agua, refrescos y zumos",Tónicas,LITRO,3.0,0.75,Agua y refrescos,otra
Tónica premium bohemian berry sensation Royal Bliss lata 25 cl,"Agua, refrescos y zumos",Tónicas,LITRO,3.0,0.75,Agua y refrescos,otra
Tónica de limón Schweppes lata 33 cl,"Agua, refrescos y zumos",Tónicas,LITRO,2.88,0.95,Agua y refrescos,otra
Refresco tónica Organics lata 1 l,"Agua, refrescos y zumos",Tónicas,LITRO,5.99,5.99,Agua y refrescos,otra
Tónica con toque de lima Schweppes botella 20 cl,"Agua, refrescos y zumos",Tónicas,LITRO,8.75,1.75,Agua y refrescos,otra
Tónica Nordic Mist lata 25 cl,"Agua, refrescos y zumos",Tónicas,LITRO,2.6,0.65,Agua y refrescos,otra
Tónica Toni Tónico de Dia botella 1.5 l,"Agua, refrescos y zumos",Tónicas,LITRO,0.63,0.95,Agua y refrescos,Dia
Tónica zero Schweppes botella 1 l,"Agua, refrescos y zumos",Tónicas,LITRO,1.9,1.9,Agua y refrescos,otra
Zumo de naranja 100% con pulpa Zumosfera de Dia brik 1 l,"Agua, refrescos y zumos",Zumos,LITRO,1.75,1.75,Zumos,Dia
Bebida de frutas con leche tropical Zumosfera de Dia brik 1 l,"Agua, refrescos y zumos",Zumos,LITRO,0.95,0.95,Zumos,Dia
Néctar piña Granini botella 1 l,"Agua, refrescos y zumos",Zumos,LITRO,2.69,2.69,Agua y refrescos,otra
Zumo de naranja Simon Life botella 1.5 l,"Agua, refrescos y zumos",Zumos,LITRO,1.23,1.85,Zumos,otra
Zumo de manzana 100% Zumosfera de Dia brik 6 x 200 ml,"Agua, refrescos y zumos",Zumos,LITRO,1.16,1.39,Zumos,Dia
Bebida con leche tropical Pascual Bifrutas brik 3 x 330 ml,"Agua, refrescos y zumos",Zumos,LITRO,2.52,2.49,Agua y refrescos,otra
Néctar light piña Juver Disfruta brik 6 x 200 ml,"Agua, refrescos y zumos",Zumos,LITRO,2.49,2.99,Agua y refrescos,otra
Néctar melocotón sin azúcares añadidos Juver Disfruta brik 6 x 200 ml,"Agua, refrescos y zumos",Zumos,LITRO,2.49,2.99,Agua y refrescos,otra
Limonada natural con gas Don Simón lata 33 cl,"Agua, refrescos y zumos",Zumos,LITRO,2.27,0.75,Agua y refrescos,otra
Bebida de leche y zumo de frutas tropical Don Simón pack 4 x 330 ml,"Agua, refrescos y zumos",Zumos,LITRO,1.13,1.49,Zumos,otra
Néctar light de naranja y uva Juver brik 1.5 l,"Agua, refrescos y zumos",Zumos,LITRO,1.9,2.85,Agua y refrescos,otra
Néctar light de piña Juver Disfruta brik 1.5 l,"Agua, refrescos y zumos",Zumos,LITRO,1.9,2.85,Agua y refrescos,otra
Néctar light de melocotón Juver Disfruta brik 1.5 l,"Agua, refrescos y zumos",Zumos,LITRO,1.9,2.85,Agua y refrescos,otra
Néctar light manzana Juver Disfruta brik 1.5 l,"Agua, refrescos y zumos",Zumos,LITRO,1.66,2.49,Agua y refrescos,otra
Néctar light 10 frutas con 10 vitaminas Juver Disfruta brik 1.5 l,"Agua, refrescos y zumos",Zumos,LITRO,1.66,2.49,Agua y refrescos,otra
Zumo exprimido de uva Merlot y uva roja 100% Zumosfera de Dia brik 1 l,"Agua, refrescos y zumos",Zumos,LITRO,1.99,1.99,Zumos,Dia
Bebida refrescante sabor piña colada Zumosfera de Dia botella 1 l,"Agua, refrescos y zumos",Zumos,LITRO,1.49,1.49,Zumos,Dia
Bebida de zumo de frutas tropical con bebida de avena Pascual Bifrutas botella 240 ml,"Agua, refrescos y zumos",Zumos,LITRO,4.54,1.09,Zumos,otra
Zumo de manzana sin azúcares añadidos Zumosfera de Dia brik 1 l,"Agua, refrescos y zumos",Zumos,LITRO,0.89,0.89,Zumos,Dia
Zumo de melocotón sin azúcares añadidos Zumosfera de Dia brik 1 l,"Agua, refrescos y zumos",Zumos,LITRO,0.99,0.99,Zumos,Dia
Zumo de naranja sin azúcares añadidos Zumosfera de Dia brik 1 l,"Agua, refrescos y zumos",Zumos,LITRO,0.95,0.95,Zumos,Dia
Zumo de piña sin azúcares añadidos Zumosfera de Dia brik 1 l,"Agua, refrescos y zumos",Zumos,LITRO,0.89,0.89,Zumos,Dia
Bebida refrescante sabor mojito Zumosfera de Dia brik 1 l,"Agua, refrescos y zumos",Zumos,LITRO,1.49,1.49,Zumos,Dia
Limonada Zumosfera de Dia botella 1 l,"Agua, refrescos y zumos",Zumos,LITRO,1.49,1.49,Zumos,Dia
Refresco vitamin brainboost zero Viwa botella 600 ml,"Agua, refrescos y zumos",Bebidas isotónicas,LITRO,2.92,1.75,Agua y refrescos,otra
Bebida refrescante de naranja zero Aquarius lata 330 ml,"Agua, refrescos y zumos",Bebidas isotónicas,LITRO,2.7,0.89,Agua y refrescos,Aquarius
Bebida refrescante de naranja Aquarius lata 330 ml,"Agua, refrescos y zumos",Bebidas isotónicas,LITRO,2.7,0.89,Agua y refrescos,Aquarius
Bebida refrescante aromatizada azul Get move de Dia botella 500 ml,"Agua, refrescos y zumos",Bebidas isotónicas,LITRO,1.2,0.6,Agua y refrescos,Dia
Bebida refrescante de limón Aquarius lata 9 x 33 cl,"Agua, refrescos y zumos",Bebidas isotónicas,LITRO,2.59,7.69,Agua y refrescos,Aquarius
Bebida refrescante de naranja Aquarius lata 9 x 33 cl,"Agua, refrescos y zumos",Bebidas isotónicas,LITRO,2.59,7.69,Agua y refrescos,Aquarius
Bebida refrescante aromatizada cítrico zero Get move de Dia botella 1.5 l,"Agua, refrescos y zumos",Bebidas isotónicas,LITRO,0.63,0.95,Agua y refrescos,Dia
Bebida refrescante de limón Aquarius botella 2 x 1.5 l,"Agua, refrescos y zumos",Bebidas isotónicas,LITRO,1.3,3.89,Agua y refrescos,Aquarius
Bebida refrescante de limón zero Aquarius lata 330 ml,"Agua, refrescos y zumos",Bebidas isotónicas,LITRO,2.7,0.89,Agua y refrescos,Aquarius
Bebida refrescante aromatizada naranja Get move de Dia botella 1.5 l,"Agua, refrescos y zumos",Bebidas isotónicas,LITRO,0.63,0.95,Agua y refrescos,Dia
Bebida refrescante aromatizada cítrico Get move de Dia botella 1.5 l,"Agua, refrescos y zumos",Bebidas isotónicas,LITRO,0.63,0.95,Agua y refrescos,Dia
Bebida refrescante de limón zero Aquarius botella 1.5 l,"Agua, refrescos y zumos",Bebidas isotónicas,LITRO,1.09,1.64,Agua y refrescos,Aquarius
Bebida refrescante de naranja zero Aquarius botella 1.5 l,"Agua, refrescos y zumos",Bebidas isotónicas,LITRO,1.33,1.99,Agua y refrescos,Aquarius
