Nombre,Categoria1,Categoria2,UM,Precio Unitario,Precio,categoria_principal,Marca
Recambios cepillo dental eléctrico Imaqe de Dia blister 2 unidades,"Perfumería, higiene, salud",Cuidado bucal,UNIDAD,1.93,3.85,Fitoterapia y parafarmacia,Imaqe de Dia
Arcos dentales sabor menta Imaqe de Dia caja 30 unidades,"Perfumería, higiene, salud",Cuidado bucal,UNIDAD,0.03,0.9,Fitoterapia y parafarmacia,Imaqe de Dia
Crema corporal nutritiva piel muy seca Nivea botella 500 ml,"Perfumería, higiene, salud",Hidratación corporal,100 ML.,1.1,5.5,Fitoterapia y parafarmacia,otra
Crema hidratante intensiva Nivea bote 375 ml,"Perfumería, higiene, salud",Hidratación corporal,100 ML.,1.6,5.99,Fitoterapia y parafarmacia,otra
Iluminador corporal perfumado Imaqe de Dia botella 100 ml,"Perfumería, higiene, salud",Hidratación corporal,100 ML.,3.9,3.9,Fitoterapia y parafarmacia,Imaqe de Dia
Calcetín exfoliante para pies Imaqe de Dia bolsa 2 unidades,"Perfumería, higiene, salud",Hidratación corporal,UNIDAD,3.48,6.95,Fitoterapia y parafarmacia,Imaqe de Dia
Calcetín ultra hidratante para pies Imaqe de Dia bolsa 2 unidades,"Perfumería, higiene, salud",Hidratación corporal,UNIDAD,2.25,4.5,Fitoterapia y parafarmacia,Imaqe de Dia
Aceite corporal anticelulítico  Imaqe de Dia botella 100 ml,"Perfumería, higiene, salud",Hidratación corporal,100 ML.,3.5,3.5,Fitoterapia y parafarmacia,Imaqe de Dia
Manteca corporal nutritiva Imaqe de Dia bote 200 ml,"Perfumería, higiene, salud",Hidratación corporal,100 ML.,2.5,4.99,Fitoterapia y parafarmacia,Imaqe de Dia
Body milk hidratante natural  Imaqe de Dia bote 250 ml,"Perfumería, higiene, salud",Hidratación corporal,100 ML.,1.6,3.99,Fitoterapia y parafarmacia,Imaqe de Dia
Aceite corporal aromaterapia Imaqe de Dia botella 250 ml,"Perfumería, higiene, salud",Hidratación corporal,100 ML.,1.4,3.5,Fitoterapia y parafarmacia,Imaqe de Dia
Aceite corporal argán Imaqe de Dia botella 400 ml,"Perfumería, higiene, salud",Hidratación corporal,100 ML.,0.74,2.95,Fitoterapia y parafarmacia,Imaqe de Dia
Aceite corporal aloe vera Imaqe de Dia botella 400 ml,"Perfumería, higiene, salud",Hidratación corporal,100 ML.,0.64,2.55,Fitoterapia y parafarmacia,Imaqe de Dia
Exfoliante corporal aromaterapia extracto de lavanda Imaqe de Dia bote 250 ml,"Perfumería, higiene, salud",Hidratación corporal,100 ML.,1.72,4.3,Fitoterapia y parafarmacia,Imaqe de Dia
Crema corporal aromaterapia Imaqe de Dia botella 240 ml,"Perfumería, higiene, salud",Hidratación corporal,100 ML.,1.08,2.6,Fitoterapia y parafarmacia,Imaqe de Dia
Crema corporal con vitaminas encapsuladas  Imaqe de Dia bote 250 ml,"Perfumería, higiene, salud",Hidratación corporal,100 ML.,1.18,2.95,Fitoterapia y parafarmacia,Imaqe de Dia
Crema corporal hidratante con ceramidas Imaqe de Dia bote 250 ml,"Perfumería, higiene, salud",Hidratación corporal,100 ML.,1.04,2.6,Fitoterapia y parafarmacia,Imaqe de Dia
Crema corporal regeneradora rosa mosqueta Imaqe de Dia bote 250 ml,"Perfumería, higiene, salud",Hidratación corporal,100 ML.,1.04,2.6,Fitoterapia y parafarmacia,Imaqe de Dia
Crema corporal nutritiva oliva y péptidos Imaqe de Dia bote 250 ml,"Perfumería, higiene, salud",Hidratación corporal,100 ML.,0.6,1.5,Fitoterapia y parafarmacia,Imaqe de Dia
Body milk reafirmante vitamina C y Q10 Imaqe de Dia botella 400 ml,"Perfumería, higiene, salud",Hidratación corporal,100 ML.,0.49,1.95,Fitoterapia y parafarmacia,Imaqe de Dia
Body milk nutritivo almendras y prebióticos  Imaqe de Dia botella 400 ml,"Perfumería, higiene, salud",Hidratación corporal,100 ML.,0.49,1.95,Fitoterapia y parafarmacia,Imaqe de Dia
Body milk hidratante aloe vera y ácido hialurónico Imaqe de Dia botella 400 ml,"Perfumería, higiene, salud",Hidratación corporal,100 ML.,0.49,1.95,Fitoterapia y parafarmacia,Imaqe de Dia
Crema exfoliante para pies piedra pómez Imaqe de Dia tubo 125 ml,"Perfumería, higiene, salud",Hidratación corporal,100 ML.,1.52,1.9,Fitoterapia y parafarmacia,Imaqe de Dia
Gel frío calmante para pies y piernas Imaqe de Dia tubo 125 ml,"Perfumería, higiene, salud",Hidratación corporal,100 ML.,1.24,1.55,Fitoterapia y parafarmacia,Imaqe de Dia
Crema reparadora para pies con urea Imaqe de Dia tubo 125 ml,"Perfumería, higiene, salud",Hidratación corporal,100 ML.,0.96,1.2,Fitoterapia y parafarmacia,Imaqe de Dia
Crema de manos natural reparadora Imaqe de Dia tubo 75 ml,"Perfumería, higiene, salud",Hidratación corporal,100 ML.,2.65,1.99,Fitoterapia y parafarmacia,Imaqe de Dia
Calcetín efecto frío hidratante Iroha bolsa 2 unidades,"Perfumería, higiene, salud",Hidratación corporal,UNIDAD,2.45,4.9,Fitoterapia y parafarmacia,otra
Crema exfoliante para pies bio Eudermin bote 75 ml,"Perfumería, higiene, salud",Hidratación corporal,100 ML.,3.33,2.5,Fitoterapia y parafarmacia,otra
Crema corporal vitamina b3 Babaria bote 400 ml,"Perfumería, higiene, salud",Hidratación corporal,100 ML.,0.8,3.2,Fitoterapia y parafarmacia,otra
Crema corporal vitamina c Babaria bote 400 ml,"Perfumería, higiene, salud",Hidratación corporal,100 ML.,0.8,3.2,Fitoterapia y parafarmacia,otra
Leche corporal vitamina b3 Babaria bote 500 ml,"Perfumería, higiene, salud",Hidratación corporal,100 ML.,0.6,2.99,Fitoterapia y parafarmacia,otra
Desodorante cobalt blue Rexona spray 200 ml,"Perfumería, higiene, salud",Desodorantes,100 ML.,1.35,2.7,Fitoterapia y parafarmacia,otra
Desodorante roll-on confort Nivea bote 50 ml,"Perfumería, higiene, salud",Desodorantes,100 ML.,4.3,2.15,Fitoterapia y parafarmacia,otra
Desodorante BzRP black remixed Axe spray 150 ml,"Perfumería, higiene, salud",Desodorantes,100 ML.,2.46,3.69,Fitoterapia y parafarmacia,otra
Desodorante original 0% Dove spray 150 ml,"Perfumería, higiene, salud",Desodorantes,100 ML.,2.53,3.79,Fitoterapia y parafarmacia,otra
Desodorante roll-on dermo total protection Sanex bote 50 ml,"Perfumería, higiene, salud",Desodorantes,100 ML.,4.5,2.25,Fitoterapia y parafarmacia,otra
Desodorante go fresh pepino y té verde Dove spray 200 ml,"Perfumería, higiene, salud",Desodorantes,100 ML.,2.0,3.99,Fitoterapia y parafarmacia,otra
Desodorante advanced care original Dove spray 200 ml,"Perfumería, higiene, salud",Desodorantes,100 ML.,2.0,3.99,Fitoterapia y parafarmacia,otra
Desodorante advanced care invisible Dove spray 200 ml,"Perfumería, higiene, salud",Desodorantes,100 ML.,1.78,3.55,Cuidado facial y corporal,otra
Desodorante roll-on + motionsense tropical Rexona bote 50 ml,"Perfumería, higiene, salud",Desodorantes,100 ML.,4.3,2.15,Fitoterapia y parafarmacia,otra
Desodorante roll-on invisible Dove bote 50 ml,"Perfumería, higiene, salud",Desodorantes,100 ML.,4.98,2.49,Fitoterapia y parafarmacia,otra
Desodorante roll-on advanced care original Dove bote 50 ml,"Perfumería, higiene, salud",Desodorantes,100 ML.,4.98,2.49,Fitoterapia y parafarmacia,otra
Desodorante copper santal Axe spray 150 ml,"Perfumería, higiene, salud",Desodorantes,100 ML.,3.57,5.35,Fitoterapia y parafarmacia,otra
Desodorante aqua bergamot Axe spray 150 ml,"Perfumería, higiene, salud",Desodorantes,100 ML.,3.57,5.35,Fitoterapia y parafarmacia,otra
Desodorante roll-on dermo extra control duplo Sanex bote 100 ml,"Perfumería, higiene, salud",Desodorantes,100 ML.,3.99,3.99,Fitoterapia y parafarmacia,otra
Desodorante spray mujer Rexona spray 200 ml,"Perfumería, higiene, salud",Desodorantes,100 ML.,1.8,3.59,Fitoterapia y parafarmacia,otra
Desodorante roll-on dry & protect Imaqe de Dia bote 50 ml,"Perfumería, higiene, salud",Desodorantes,100 ML.,1.7,0.85,Fitoterapia y parafarmacia,Imaqe de Dia
Desodorante sin sales de aluminio Imaqe de Dia spray 200 ml,"Perfumería, higiene, salud",Desodorantes,100 ML.,0.98,1.95,Fitoterapia y parafarmacia,Imaqe de Dia
Desodorante roll-on invisible & antimanchas hombre Imaqe de Dia bote 50 ml,"Perfumería, higiene, salud",Desodorantes,100 ML.,1.7,0.85,Fitoterapia y parafarmacia,Imaqe de Dia
Desodorante roll-on para pieles atópicas Imaqe de Dia bote 50 ml,"Perfumería, higiene, salud",Desodorantes,100 ML.,1.7,0.85,Fitoterapia y parafarmacia,Imaqe de Dia
Desodorante roll-on invisible & antimanchas Imaqe de Dia bote 50 ml,"Perfumería, higiene, salud",Desodorantes,100 ML.,1.7,0.85,Fitoterapia y parafarmacia,Imaqe de Dia
Desodorante roll-on con extracto de rosa mosqueta Imaqe de Dia bote 50 ml,"Perfumería, higiene, salud",Desodorantes,100 ML.,1.7,0.85,Fitoterapia y parafarmacia,Imaqe de Dia
Desodorante roll-on dermo sensitive Imaqe de Dia bote 50 ml,"Perfumería, higiene, salud",Desodorantes,100 ML.,1.7,0.85,Fitoterapia y parafarmacia,Imaqe de Dia
Desodorante roll-on dermo algodón Imaqe de Dia bote 50 ml,"Perfumería, higiene, salud",Desodorantes,100 ML.,1.7,0.85,Fitoterapia y parafarmacia,Imaqe de Dia
Desodorante leather man Imaqe de Dia spray 150 ml,"Perfumería, higiene, salud",Desodorantes,100 ML.,1.26,1.89,Fitoterapia y parafarmacia,Imaqe de Dia
Desodorante apollo man Imaqe de Dia spray 150 ml,"Perfumería, higiene, salud",Desodorantes,100 ML.,1.26,1.89,Fitoterapia y parafarmacia,Imaqe de Dia
Desodorante dark temptation man Imaqe de Dia spray 150 ml,"Perfumería, higiene, salud",Desodorantes,100 ML.,1.26,1.89,Fitoterapia y parafarmacia,Imaqe de Dia
Desodorante black and white hombre Imaqe de Dia spray 200 ml,"Perfumería, higiene, salud",Desodorantes,100 ML.,0.98,1.95,Fitoterapia y parafarmacia,Imaqe de Dia
Desodorante black and white Imaqe de Dia spray 200 ml,"Perfumería, higiene, salud",Desodorantes,100 ML.,0.98,1.95,Fitoterapia y parafarmacia,Imaqe de Dia
Colonia instant crush mini Flor de mayo frasco 22 ml,"Perfumería, higiene, salud",Colonias,100 ML.,7.73,1.7,Fitoterapia y parafarmacia,otra
Body mist sicilian lemon Imaqe de Dia spray 200 ml,"Perfumería, higiene, salud",Colonias,100 ML.,1.5,3.0,Fitoterapia y parafarmacia,Imaqe de Dia
Body mist rose petals Imaqe de Dia spray 200 ml,"Perfumería, higiene, salud",Colonias,100 ML.,1.5,3.0,Fitoterapia y parafarmacia,Imaqe de Dia
Agua de colonia original 1953 Tulipán Negro botella 800 ml,"Perfumería, higiene, salud",Colonias,100 ML.,0.46,3.69,Fitoterapia y parafarmacia,otra
Body mist verbena flower Imaqe de Dia spray 200 ml,"Perfumería, higiene, salud",Colonias,100 ML.,1.5,3.0,Fitoterapia y parafarmacia,Imaqe de Dia
Body mist summer bouquet Imaqe de Dia spray 200 ml,"Perfumería, higiene, salud",Colonias,100 ML.,1.5,3.0,Fitoterapia y parafarmacia,Imaqe de Dia
Body mist coconut Imaqe de Dia spray 200 ml,"Perfumería, higiene, salud",Colonias,100 ML.,1.5,3.0,Fitoterapia y parafarmacia,Imaqe de Dia
Loción corporal passionate romance shimmer Flor de mayo frasco 195 ml,"Perfumería, higiene, salud",Colonias,100 ML.,1.53,2.99,Fitoterapia y parafarmacia,otra
Colonia matcha is a mood The Seven Cosmetics frasco 100 ml,"Perfumería, higiene, salud",Colonias,100 ML.,7.95,7.95,Fitoterapia y parafarmacia,otra
Colonia kombucha is a party The Seven Cosmetics frasco 100 ml,"Perfumería, higiene, salud",Colonias,100 ML.,7.95,7.95,Fitoterapia y parafarmacia,otra
Colonia chai is a brake The Seven Cosmetics frasco 100 ml,"Perfumería, higiene, salud",Colonias,100 ML.,7.95,7.95,Fitoterapia y parafarmacia,otra
Body mist berries Flor de mayo spray 200 ml,"Perfumería, higiene, salud",Colonias,100 ML.,1.25,2.5,Fitoterapia y parafarmacia,otra
Set de colonia wow Flor de mayo frasco 28 ml,"Perfumería, higiene, salud",Colonias,100 ML.,12.5,3.5,Fitoterapia y parafarmacia,otra
Colonia blue mini Flor de mayo frasco 23 ml,"Perfumería, higiene, salud",Colonias,100 ML.,7.39,1.7,Fitoterapia y parafarmacia,otra
Agua de colonia familiar lavanda Imaqe de Dia frasco 750 ml,"Perfumería, higiene, salud",Colonias,100 ML.,0.26,1.95,Fitoterapia y parafarmacia,Imaqe de Dia
Agua de colonia familiar fresh Imaqe de Dia frasco 750 ml,"Perfumería, higiene, salud",Colonias,100 ML.,0.26,1.95,Fitoterapia y parafarmacia,Imaqe de Dia
Agua de colonia fragancia original Nenuco botella 650 ml,"Perfumería, higiene, salud",Colonias,100 ML.,0.61,3.99,Fitoterapia y parafarmacia,otra
Colonia sweet explos Ice cream caja 1 unidad,"Perfumería, higiene, salud",Colonias,UNIDAD,3.25,3.25,Fitoterapia y parafarmacia,otra
Colonia shiny rainbo Ice cream caja 1 unidad,"Perfumería, higiene, salud",Colonias,UNIDAD,3.25,3.25,Fitoterapia y parafarmacia,otra
Body mist con esencia de citronela Imaqe de Dia spray 100 ml,"Perfumería, higiene, salud",Colonias,100 ML.,1.89,1.89,Fitoterapia y parafarmacia,Imaqe de Dia
Colonia sweet blosson Nike frasco 150 ml,"Perfumería, higiene, salud",Colonias,100 ML.,9.57,14.35,Fitoterapia y parafarmacia,otra
Colonia verbena Arome de fleur frasco 150 ml,"Perfumería, higiene, salud",Colonias,100 ML.,3.97,5.95,Fitoterapia y parafarmacia,otra
Colonia flores blancas Arome de fleur frasco 150 ml,"Perfumería, higiene, salud",Colonias,100 ML.,3.97,5.95,Fitoterapia y parafarmacia,otra
Colonia bergamota Arome de fleur frasco 150 ml,"Perfumería, higiene, salud",Colonias,100 ML.,3.97,5.95,Fitoterapia y parafarmacia,otra
Agua de colonia clásica fresh S3 frasco 750 ml,"Perfumería, higiene, salud",Colonias,100 ML.,0.46,3.45,Fitoterapia y parafarmacia,otra
Colonia jazz aromatic Melody frasco 100 ml,"Perfumería, higiene, salud",Colonias,100 ML.,3.99,3.99,Fitoterapia y parafarmacia,otra
Colonia sonata dulce Melody frasco 100 ml,"Perfumería, higiene, salud",Colonias,100 ML.,3.99,3.99,Fitoterapia y parafarmacia,otra
Agua fresca de flor de naranjo Álvarez Gómez bote 300 ml,"Perfumería, higiene, salud",Colonias,100 ML.,0.98,2.95,Fitoterapia y parafarmacia,otra
Colonia de mango Fruits attraction frasco 100 ml,"Perfumería, higiene, salud",Colonias,100 ML.,4.75,4.75,Fitoterapia y parafarmacia,otra
Colonia de coco Fruits attraction frasco 100 ml,"Perfumería, higiene, salud",Colonias,100 ML.,4.75,4.75,Fitoterapia y parafarmacia,otra
Jabón de manos líquido leche y miel Palmolive bote 300 ml,"Perfumería, higiene, salud",Jabón de manos,100 ML.,0.8,2.39,Fitoterapia y parafarmacia,otra
Jabón de manos Dove 2 x 90 g,"Perfumería, higiene, salud",Jabón de manos,100 GR.,1.11,1.99,Fitoterapia y parafarmacia,otra
Jabón de manos líquido tradición Imaqe de Dia bote 500 ml,"Perfumería, higiene, salud",Jabón de manos,100 ML.,0.26,1.3,Fitoterapia y parafarmacia,Imaqe de Dia
Jabón de manos argán Natural Honey bolsa 2 x 100 g,"Perfumería, higiene, salud",Jabón de manos,100 GR.,1.28,2.55,Fitoterapia y parafarmacia,otra
Jabón de manos líquido aloe vera Imaqe de Dia bote 500 ml,"Perfumería, higiene, salud",Jabón de manos,100 ML.,0.2,0.99,Fitoterapia y parafarmacia,Imaqe de Dia
Jabón de manos líquido oliva Imaqe de Dia bote 500 ml,"Perfumería, higiene, salud",Jabón de manos,100 ML.,0.26,1.3,Fitoterapia y parafarmacia,Imaqe de Dia
Recambio jabón de manos líquido aloe vera Imaqe de Dia bolsa 500 ml,"Perfumería, higiene, salud",Jabón de manos,100 ML.,0.16,0.79,Fitoterapia y parafarmacia,Imaqe de Dia
Jabón de manos líquido infantil Planeta Junior de Dia bote 500 ml,"Perfumería, higiene, salud",Jabón de manos,100 ML.,0.26,1.3,Fitoterapia y parafarmacia,Dia
Recambio jabón de manos líquido almendra y miel Imaqe de Dia bolsa 500 ml,"Perfumería, higiene, salud",Jabón de manos,100 ML.,0.19,0.95,Fitoterapia y parafarmacia,Imaqe de Dia
Jabón de manos líquido rosa y jazmín Imaqe de Dia bote 500 ml,"Perfumería, higiene, salud",Jabón de manos,100 ML.,0.27,1.35,Fitoterapia y parafarmacia,Imaqe de Dia
Jabón de manos líquido neutralizador de olores Imaqe de Dia bote 500 ml,"Perfumería, higiene, salud",Jabón de manos,100 ML.,0.31,1.55,Fitoterapia y parafarmacia,Imaqe de Dia
Jabón de manos líquido glicerina Imaqe de Dia bote 500 ml,"Perfumería, higiene, salud",Jabón de manos,100 ML.,0.27,1.35,Fitoterapia y parafarmacia,Imaqe de Dia
Jabón de manos líquido almendra y miel Imaqe de Dia bote 500 ml,"Perfumería, higiene, salud",Jabón de manos,100 ML.,0.26,1.3,Fitoterapia y parafarmacia,Imaqe de Dia
Jabón de manos líquido hidratante Sanytol bote 250 ml,"Perfumería, higiene, salud",Jabón de manos,100 ML.,0.88,2.19,Fitoterapia y parafarmacia,otra
Jabón de manos líquido para niños Johnson bote 300 ml,"Perfumería, higiene, salud",Jabón de manos,100 ML.,0.66,1.99,Fitoterapia y parafarmacia,otra
Jabón de manos líquido dermo protector Sanex bote 250 ml,"Perfumería, higiene, salud",Jabón de manos,100 ML.,0.96,2.39,Fitoterapia y parafarmacia,otra
Jabón de manos delicate care 3 unidades Palmolive 270 g,"Perfumería, higiene, salud",Jabón de manos,100 GR.,0.85,2.29,Fitoterapia y parafarmacia,otra
Jabón de manos líquido almendra Palmolive bote 300 ml,"Perfumería, higiene, salud",Jabón de manos,100 ML.,0.8,2.39,Fitoterapia y parafarmacia,otra
Jabón de manos clásico Magno 2 x 100 g,"Perfumería, higiene, salud",Jabón de manos,100 GR.,1.25,2.49,Fitoterapia y parafarmacia,otra
Compresas de incontinencia extra Bonté Everyday de Dia bolsa 20 unidades,"Perfumería, higiene, salud",Compresas y cuidado íntimo,UNIDAD,0.17,3.35,Fitoterapia y parafarmacia,Dia
Compresas de incontinencia extra Tena bolsa 10 unidades,"Perfumería, higiene, salud",Compresas y cuidado íntimo,UNIDAD,0.47,4.65,Fitoterapia y parafarmacia,otra
Protegeslips flexiform Carefree caja 30 unidades,"Perfumería, higiene, salud",Compresas y cuidado íntimo,UNIDAD,0.07,2.06,Fitoterapia y parafarmacia,otra
Compresas super con alas Evax bolsa 10 unidades,"Perfumería, higiene, salud",Compresas y cuidado íntimo,UNIDAD,0.28,2.83,Fitoterapia y parafarmacia,otra
Tampón regular Tampax caja 22 unidades,"Perfumería, higiene, salud",Compresas y cuidado íntimo,UNIDAD,0.2,4.39,Fitoterapia y parafarmacia,otra
Tampón super Tampax caja 20 unidades,"Perfumería, higiene, salud",Compresas y cuidado íntimo,UNIDAD,0.22,4.39,Fitoterapia y parafarmacia,otra
Compresas incontinencia normal Ausonia Discreet bolsa 14 unidades,"Perfumería, higiene, salud",Compresas y cuidado íntimo,UNIDAD,0.39,5.49,Fitoterapia y parafarmacia,otra
Compresas incontinencia mini Ausonia bolsa 24 unidades,"Perfumería, higiene, salud",Compresas y cuidado íntimo,UNIDAD,0.23,5.49,Fitoterapia y parafarmacia,otra
Toallitas de higiene íntima Imaqe de Dia bolsa 20 unidades,"Perfumería, higiene, salud",Compresas y cuidado íntimo,UNIDAD,0.05,1.0,Fitoterapia y parafarmacia,Imaqe de Dia
Compresas con alas Evax caja 64 unidades,"Perfumería, higiene, salud",Compresas y cuidado íntimo,UNIDAD,0.13,8.48,Fitoterapia y parafarmacia,otra
Protegeslips algodón orgánico Carefree caja 30 unidades,"Perfumería, higiene, salud",Compresas y cuidado íntimo,UNIDAD,0.1,2.99,Fitoterapia y parafarmacia,otra
Protegeslips cotton-algodón maxi Esos Dias caja 28 unidades,"Perfumería, higiene, salud",Compresas y cuidado íntimo,UNIDAD,0.07,1.85,Fitoterapia y parafarmacia,Dia
Protegeslips cotton-algodón normal Esos Dias caja 28 unidades,"Perfumería, higiene, salud",Compresas y cuidado íntimo,UNIDAD,0.07,1.85,Fitoterapia y parafarmacia,Dia
Protector cubrecamas 60x90 cm Amd bolsa 30 unidades,"Perfumería, higiene, salud",Compresas y cuidado íntimo,UNIDAD,0.33,9.99,Fitoterapia y parafarmacia,otra
Tampón con aplicador compact normal Esos Dias caja 32 unidades,"Perfumería, higiene, salud",Compresas y cuidado íntimo,UNIDAD,0.1,3.2,Fitoterapia y parafarmacia,Dia
Protegeslips duoform Esos Dias caja 30 unidades,"Perfumería, higiene, salud",Compresas y cuidado íntimo,UNIDAD,0.06,1.89,Fitoterapia y parafarmacia,Dia
Protegeslips maxi Esos Dias caja 36 unidades,"Perfumería, higiene, salud",Compresas y cuidado íntimo,UNIDAD,0.05,1.89,Fitoterapia y parafarmacia,Dia
Protegeslips normal plegado Esos Dias bolsa 30 unidades,"Perfumería, higiene, salud",Compresas y cuidado íntimo,UNIDAD,0.06,1.65,Fitoterapia y parafarmacia,Dia
Protegeslips normal Esos Dias caja 50 unidades,"Perfumería, higiene, salud",Compresas y cuidado íntimo,UNIDAD,0.04,1.79,Fitoterapia y parafarmacia,Dia
Protegeslips clásico Esos Dias caja 40 unidades,"Perfumería, higiene, salud",Compresas y cuidado íntimo,UNIDAD,0.02,0.99,Fitoterapia y parafarmacia,Dia
Compresas ultrafinas cotton-algodón súper con alas Esos Dias bolsa 12 unidades,"Perfumería, higiene, salud",Compresas y cuidado íntimo,UNIDAD,0.17,1.99,Fitoterapia y parafarmacia,Dia
Compresas ultrafina noche con alas Esos Dias bolsa 10 unidades,"Perfumería, higiene, salud",Compresas y cuidado íntimo,UNIDAD,0.16,1.59,Fitoterapia y parafarmacia,Dia
Compresas ultrafinas super con alas Esos Dias bolsa 14 unidades,"Perfumería, higiene, salud",Compresas y cuidado íntimo,UNIDAD,0.11,1.49,Fitoterapia y parafarmacia,Dia
Compresas ultrafinas normal con alas Esos Dias bolsa 16 unidades,"Perfumería, higiene, salud",Compresas y cuidado íntimo,UNIDAD,0.09,1.49,Fitoterapia y parafarmacia,Dia
Compresas ultrafina normal sin alas Esos Dias bolsa 16 unidades,"Perfumería, higiene, salud",Compresas y cuidado íntimo,UNIDAD,0.09,1.49,Fitoterapia y parafarmacia,Dia
Compresas clásicas noche sin alas Esos Dias bolsa 10 unidades,"Perfumería, higiene, salud",Compresas y cuidado íntimo,UNIDAD,0.18,1.79,Fitoterapia y parafarmacia,Dia
Compresas súper plegada esos Esos Dias bolsa 16 unidades,"Perfumería, higiene, salud",Compresas y cuidado íntimo,UNIDAD,0.08,1.32,Fitoterapia y parafarmacia,Dia
Compresas normal plegada esos Esos Dias bolsa 18 unidades,"Perfumería, higiene, salud",Compresas y cuidado íntimo,UNIDAD,0.06,1.06,Fitoterapia y parafarmacia,Dia
Palo universal rojo Vileda 1 unidad,Limpieza y hogar,Utensilios de limpieza,UNIDAD,4.59,4.59,Limpieza y hogar,otra
Fregona en tiras ultraseca Scotch brite bolsa 1 unidad,Limpieza y hogar,Utensilios de limpieza,UNIDAD,2.69,2.69,Limpieza y hogar,otra
Guantes desechables de látex multiusos talla S/M Vileda caja 10 unidades,Limpieza y hogar,Utensilios de limpieza,UNIDAD,0.46,4.59,Limpieza y hogar,otra
Bayeta amarilla super absorbente y extra suave Ballerina bolsa 4 unidades,Limpieza y hogar,Utensilios de limpieza,UNIDAD,0.62,2.49,Limpieza y hogar,otra
Guantes reutilizables triple capa talla M Spontex bolsa 2 unidades,Limpieza y hogar,Utensilios de limpieza,UNIDAD,1.6,3.19,Limpieza y hogar,otra
Estropajo salvauñas delicate Scotch brite pack 2 unidades,Limpieza y hogar,Utensilios de limpieza,UNIDAD,1.05,2.09,Limpieza y hogar,otra
Fregona de microfibra Rozenbal bolsa 1 unidad,Limpieza y hogar,Utensilios de limpieza,UNIDAD,3.55,3.55,Limpieza y hogar,otra
Fregona estampada Super Paco de Dia bolsa 1 unidad,Limpieza y hogar,Utensilios de limpieza,UNIDAD,1.4,1.4,Limpieza y hogar,Dia
Recogedor antivuelco gris y celeste Sp berner 1 unidad,Limpieza y hogar,Utensilios de limpieza,UNIDAD,2.45,2.45,Limpieza y hogar,otra
Palo antideslizante gris y celeste Sp berner 1 unidad,Limpieza y hogar,Utensilios de limpieza,UNIDAD,1.69,1.69,Limpieza y hogar,otra
Cubo ovalado gris y celeste 14 lt Sp berner 1 unidad,Limpieza y hogar,Utensilios de limpieza,UNIDAD,5.25,5.25,Limpieza y hogar,otra
Escoba antichoque gris y celeste Sp berner 1 unidad,Limpieza y hogar,Utensilios de limpieza,UNIDAD,2.25,2.25,Limpieza y hogar,otra
Bayeta ecológica Rozenbal bolsa 1 unidad,Limpieza y hogar,Utensilios de limpieza,UNIDAD,1.89,1.89,Limpieza y hogar,otra
Bayeta microfibra secavajillas Rozenbal bolsa 2 unidades,Limpieza y hogar,Utensilios de limpieza,UNIDAD,1.38,2.75,Limpieza y hogar,otra
Guantes de látex desechables talla M Bayeco caja 30 unidades,Limpieza y hogar,Utensilios de limpieza,UNIDAD,0.09,2.79,Limpieza y hogar,otra
Guantes de látex desechables talla S Bayeco caja 30 unidades,Limpieza y hogar,Utensilios de limpieza,UNIDAD,0.09,2.79,Limpieza y hogar,otra
Guantes nitrilo desechables talla M Bayeco caja 20 unidades,Limpieza y hogar,Utensilios de limpieza,UNIDAD,0.11,2.29,Limpieza y hogar,otra
Guantes nitrilo desechables talla S Bayeco caja 20 unidades,Limpieza y hogar,Utensilios de limpieza,UNIDAD,0.11,2.29,Limpieza y hogar,otra
Fregona de algodón Super Paco de Dia bolsa 1 unidad,Limpieza y hogar,Utensilios de limpieza,UNIDAD,1.1,1.1,Limpieza y hogar,Dia
Fregona de hilo de microfibras especial suelos delicados Super Paco de Dia bolsa 1 unidad,Limpieza y hogar,Utensilios de limpieza,UNIDAD,1.5,1.5,Limpieza y hogar,Dia
Fregona amarilla suave Super Paco de Dia bolsa 1 unidad,Limpieza y hogar,Utensilios de limpieza,UNIDAD,0.88,0.88,Limpieza y hogar,Dia
Borrador mágico Super Paco de Dia bolsa 3 unidades,Limpieza y hogar,Utensilios de limpieza,UNIDAD,0.48,1.45,Limpieza y hogar,Dia
Estropajo salvauñas limpieza delicada Super Paco de Dia estuche 3 unidades,Limpieza y hogar,Utensilios de limpieza,UNIDAD,0.25,0.75,Limpieza y hogar,Dia
Estropajo suciedad resistente Super Paco de Dia 3 unidades,Limpieza y hogar,Utensilios de limpieza,UNIDAD,0.3,0.9,Limpieza y hogar,Dia
Estropajo de fibra verde Super Paco de Dia bolsa 4 unidades,Limpieza y hogar,Utensilios de limpieza,UNIDAD,0.3,1.19,Limpieza y hogar,Dia
Estropajo salvauñas suciedad resistente Super Paco de Dia estuche 3 unidades,Limpieza y hogar,Utensilios de limpieza,UNIDAD,0.25,0.75,Limpieza y hogar,Dia
Estropajo acero inoxidable Super Paco de Dia bolsa 3 unidades,Limpieza y hogar,Utensilios de limpieza,UNIDAD,0.25,0.75,Limpieza y hogar,Dia
Bolsa de basura con autocierre comunidad 120 lt Super Paco de Dia 10 unidades,Limpieza y hogar,Bolsas de basura,UNIDAD,0.28,2.79,Limpieza y hogar,Dia
Bolsas de basura autocierre perfumadas 10 lt Super Paco de Dia 30 unidades,Limpieza y hogar,Bolsas de basura,UNIDAD,0.03,1.01,Limpieza y hogar,Dia
Bolsa de basura con autocierre perfumada 30 lt Super Paco de Dia 20 unidades,Limpieza y hogar,Bolsas de basura,UNIDAD,0.08,1.6,Limpieza y hogar,Dia
Bolsa de basura con autocierre 50 lt Super Paco de Dia 15 unidades,Limpieza y hogar,Bolsas de basura,UNIDAD,0.11,1.6,Limpieza y hogar,Dia
Bolsa de basura con autocierre amarilla 30 lt Super Paco de Dia 30 unidades,Limpieza y hogar,Bolsas de basura,UNIDAD,0.06,1.65,Limpieza y hogar,Dia
Bolsa de basura con autocierre azul 30 lt Super Paco de Dia 30 unidades,Limpieza y hogar,Bolsas de basura,UNIDAD,0.05,1.59,Limpieza y hogar,Dia
